{
 "cells": [
  {
   "attachments": {},
   "cell_type": "markdown",
   "id": "275d0210-e024-4794-91c4-9b3a543c6926",
   "metadata": {},
   "source": [
    "\n",
    "\n",
    "Estudando os melhores atributos e hiperparâmetros do regressor e a escolha pelo de floresta aleatória\n",
    "==================="
   ]
  },
  {
   "cell_type": "markdown",
   "id": "731611d9-ecd3-4904-ab05-6f31d4f2659d",
   "metadata": {},
   "source": [
    "### Autores: Glauber Nascimento, Rafael Anis, Maria Emily Gomes"
   ]
  },
  {
   "cell_type": "markdown",
   "id": "035867a4-5d6f-4ff7-98d9-0e07d64afc3e",
   "metadata": {},
   "source": [
    "<p style=\"text-align:justify;\"> Nesse notebook, utilizou-se o banco de dados $MSK MetTropism$, o qual foi produzido e estudado pelo grupo o qual publicou \"Genomic characterization of metastatic patterns from prospective clinical sequencing of 25,000 patients\". Nosso projeto, no entanto, irá utilizar essa vasta informação e tentar predizer o tempo de sobrevida de pacientes de <strong>Câncer de pulmão de células não pequenas</strong>. E, nesse notebook, a itenção é contar como que alcançamos nossos resultados e o porquê de ter escolhido o regressor de floresta aleatória. Esse modelo pretende discutir o tempo de sobrevida de pacientes que não foram previstos como curados, ou seja, apresentaram um tempo de sobrevida maior que 60 meses no <strong>modelo classificador</strong>.\n",
    "\n",
    "<p style=\"text-align:justify;\"> Para conseguir os melhores resultados, não só especificamos um tipo de câncer para treinar o modelo, como também escolhemos dois focos de estudos: <strong>modelo de floresta aleatória</strong> e o <strong>modelo KNN</strong> e dividimos as observações do dataset em dados de treino e de teste para verificar a performance. Além disso, houve um estudo acerca dos melhores atributos - assim como verificamos se havia multicolinearidade associada às coluna, dos melhores parâmetros com o optuna e, assim, espera-se um RMSE baixo, a modo que os resultados se mostrem relevantes. Para haver um métrica que nos possibilite obter uma sensibilidade de como está a qualidade dos modelos, iremos obter o RMSE de um modelo baseline. Então, como o RMSE do modelo de floresta aleatória foi menor que a do baseline e a do KNN, o trabalho apresentará discussões de como alcançou o resultado e como poderia aprimorá-lo."
   ]
  },
  {
   "cell_type": "markdown",
   "id": "890ade76-d779-4d69-8f14-77c54a208a12",
   "metadata": {},
   "source": [
    "### Importando as bibliotecas "
   ]
  },
  {
   "cell_type": "markdown",
   "id": "8877e1d2-da4c-413c-9271-a01f0bd60549",
   "metadata": {},
   "source": [
    "<p style=\"text-align:justify;\">  A biblioteca <strong>pandas</strong> será necessária para ler e editar o dataframe utilizado neste trabalho e a <strong>numpy</strong> para realizar operações como atribuir um valor <strong>NaN</strong> em uma nova coluna. "
   ]
  },
  {
   "cell_type": "code",
   "execution_count": 1,
   "id": "2a13fab8-2c52-4d8a-a922-e8ba13e80a21",
   "metadata": {},
   "outputs": [],
   "source": [
    "import pandas as pd\n",
    "import numpy as np"
   ]
  },
  {
   "cell_type": "markdown",
   "id": "b2a7b01a-638b-4252-bd87-28e454675eaf",
   "metadata": {},
   "source": [
    "### Leitura do dataset"
   ]
  },
  {
   "cell_type": "markdown",
   "id": "b1363b09-a9a1-4c25-845b-bafd85ed7388",
   "metadata": {},
   "source": [
    "<p style=\"text-align:justify;\"> O dataset a seguir é de onde foi realizada todas as operações necessárias para desenvolver os modelos. O primeiro foco do grupo foi encontrar os atributos relevantes para o objetivo, como também encontrar uma coluna de target adequada para a nossa discussão."
   ]
  },
  {
   "cell_type": "code",
   "execution_count": 2,
   "id": "d638d23d-6027-4a86-9ac2-fc38223473a6",
   "metadata": {},
   "outputs": [],
   "source": [
    "df = pd.read_csv(\"msk_met_2021_clinical_data (1).tsv\", sep = \"\\t\")"
   ]
  },
  {
   "cell_type": "markdown",
   "id": "f8856102-1113-4ac0-bf96-c22e6b475263",
   "metadata": {},
   "source": [
    "<p style=\"text-align:justify;\"> Em seguida, discutiu-se acerca da coluna de target, pois a sobrevida encontrada no dataset não era coerente ao dado que precisávamos para a predição. Então, a seguir, será observado como resolvemos o empasse, assim como o estudo em <strong>Trantando o Target</strong> mostra os tais problemas e o raciocínio detalhado para resolvé-lo. Em resumo, teremos uma coluna de sobrevida que avalia o tempo entre o <strong>sequenciamento genômico do paciente até o mês que foi identificado a sua morte.</strong> Contudo, produzir um modelo que prediz um tempo de vida maior que 60 meses não é pertinente, pois o tempo que observa-se um paciente de câncer é até 60 meses. Nesse sentido informar uma sobrevida de 60 ou, por exemplo, 80 meses implica na mesma situação: o paciente estará curado com os atributos que possui. "
   ]
  },
  {
   "cell_type": "code",
   "execution_count": 3,
   "id": "aafd09da-ebba-4569-96ee-574ce5502534",
   "metadata": {},
   "outputs": [],
   "source": [
    "df['Curado'] = pd.NA\n",
    "df ['Sobrevivencia (Meses)'] = pd.NA\n",
    "\n",
    "for i, meses in enumerate(df['Overall Survival (Months)']):\n",
    "    \n",
    "    if meses >= 60:\n",
    "        df.loc [i, 'Curado'] = 1\n",
    "        \n",
    "    else:\n",
    "        if df.loc [i, 'Overall Survival Status'] == '1:DECEASED':\n",
    "            df.loc [i, 'Curado'] = 0\n",
    "            df.loc [i, 'Sobrevivencia (Meses)'] = meses"
   ]
  },
  {
   "cell_type": "markdown",
   "id": "c0683088-2c6c-4d04-9e3e-3d9ca10f807c",
   "metadata": {},
   "source": [
    "<p style=\"text-align:justify;\"> Para minimizar o RMSE, optamos por selecionar um câncer específico do dataset. Considerando que o Câncer de pulmão de células não pequenas é o que apresenta a maior quantidade de observações, a predição da sobrevida de pacientes com esse tipo de câncer foi a selecionada para ser o objeto de estudo. Assim, o foco foi a busca por um modelo de baixo viés. "
   ]
  },
  {
   "cell_type": "code",
   "execution_count": 4,
   "id": "e4c7af2e-91df-467b-9110-3d14d55e2e1a",
   "metadata": {},
   "outputs": [],
   "source": [
    "df = df.loc[df[\"Cancer Type\"] == \"Non-Small Cell Lung Cancer\"]"
   ]
  },
  {
   "cell_type": "markdown",
   "id": "b2174b7c-da18-4c94-98cd-b7497b533ef2",
   "metadata": {},
   "source": [
    "#### Separando as colunas pertinentes para o modelo em atributos e target"
   ]
  },
  {
   "cell_type": "markdown",
   "id": "bba74045-1032-468b-ad87-ee87fed0e05d",
   "metadata": {},
   "source": [
    "<p style=\"text-align:justify;\"> Usaremos para o modelo atributos como o <strong>Fraction Genome Altered</strong>, o qual é a razão entre a soma dos segmentos do genoma que foram alterados pele tamanho total do genoma do paciente, esse resultado é bastante relevante para identificar o quão instável está o tumor e, desse modo, saber como está a sua progressão. Há também atributos que conseguem identificar a situação metastática do câncer a partir das informações genômicas, pois há como identificar uma hipermutação, MSI-High (MSI-H),  a partir do <strong>MSI Score</strong>, Microsatellite instability, a instabilidade de microssatélites, ou para a quantidade de mutações, informação essa que pode ser encontrada na coluna <strong>Mutation Count</strong>. O <strong>TMB (nonsynonymous)</strong>, tumor mutational burden, quantifica o número total de mutações encontradas no DNA do tumor e é considerado alto para valores maior que 10 mut/Mb, o que foi bastante encontrado em pacientes com adenocarcinoma de pulmão. A <strong>Age at Surgical Procedure</strong>, idade da operação cirúrgica, é relavante para qualquer paciente, pois, com idades distintas, os pacientes apresentam resposta à mesma operação de forma diferente. E, considerando a relevante relação entre quantidade de metátases e a sobrevida, iremos utilizar também os atributos <strong>Met Count</strong> e <strong>Met Site Count</strong>, que, respectivamente, são a quantidade de metástases e a quantidade de sítios de metástases."
   ]
  },
  {
   "cell_type": "code",
   "execution_count": 5,
   "id": "776e0d21-8b45-4c35-bbd0-4fa67b3576b3",
   "metadata": {},
   "outputs": [],
   "source": [
    "ATRIBUTOS = [                  \n",
    "        \"Age at Surgical Procedure\",           \n",
    "        \"Fraction Genome Altered\",              \n",
    "        \"Met Count\",                            \n",
    "        \"Met Site Count\",                       \n",
    "        \"MSI Score\",                   \n",
    "        \"Mutation Count\",              \n",
    "        \"TMB (nonsynonymous)\"]         \n",
    "TARGET = [\"Sobrevivencia (Meses)\"]"
   ]
  },
  {
   "cell_type": "markdown",
   "id": "3148bafd-dde2-4450-9e32-4ad4594b49fa",
   "metadata": {},
   "source": [
    "#### Encontrando o dataset com os dados que serão utilizados"
   ]
  },
  {
   "cell_type": "markdown",
   "id": "8f1a10d4-e510-4cc5-b352-38d819332e5e",
   "metadata": {},
   "source": [
    "<p style=\"text-align:justify;\"> O dataset a seguir é o tratado, no caso, há apenas pacientes que tiveram um sobrevida menor que 60 meses, as colunas selecionadas nos debates anteriores, há a eliminação de colunas que não apresentam valores e também há a conversão dos valores. "
   ]
  },
  {
   "cell_type": "code",
   "execution_count": 6,
   "id": "5e7ba154-0398-4da1-b108-40df70d3a5a4",
   "metadata": {},
   "outputs": [],
   "source": [
    "df = df.loc[df[\"Curado\"] == 0]"
   ]
  },
  {
   "cell_type": "code",
   "execution_count": 7,
   "id": "874ed84b-ab75-405e-93a2-81e7d016e1d1",
   "metadata": {},
   "outputs": [],
   "source": [
    "df = df.reindex(ATRIBUTOS + TARGET, axis=1)\n",
    "df = df.dropna()\n",
    "df = df.convert_dtypes()"
   ]
  },
  {
   "cell_type": "code",
   "execution_count": 8,
   "id": "a3aeff23-ce6e-4d2a-9eea-1f4077b36898",
   "metadata": {},
   "outputs": [
    {
     "data": {
      "text/html": [
       "<div>\n",
       "<style scoped>\n",
       "    .dataframe tbody tr th:only-of-type {\n",
       "        vertical-align: middle;\n",
       "    }\n",
       "\n",
       "    .dataframe tbody tr th {\n",
       "        vertical-align: top;\n",
       "    }\n",
       "\n",
       "    .dataframe thead th {\n",
       "        text-align: right;\n",
       "    }\n",
       "</style>\n",
       "<table border=\"1\" class=\"dataframe\">\n",
       "  <thead>\n",
       "    <tr style=\"text-align: right;\">\n",
       "      <th></th>\n",
       "      <th>Age at Surgical Procedure</th>\n",
       "      <th>Fraction Genome Altered</th>\n",
       "      <th>Met Count</th>\n",
       "      <th>Met Site Count</th>\n",
       "      <th>MSI Score</th>\n",
       "      <th>Mutation Count</th>\n",
       "      <th>TMB (nonsynonymous)</th>\n",
       "      <th>Sobrevivencia (Meses)</th>\n",
       "    </tr>\n",
       "  </thead>\n",
       "  <tbody>\n",
       "    <tr>\n",
       "      <th>44</th>\n",
       "      <td>71.17</td>\n",
       "      <td>0.2474</td>\n",
       "      <td>4</td>\n",
       "      <td>4</td>\n",
       "      <td>0.44</td>\n",
       "      <td>15</td>\n",
       "      <td>16.63733</td>\n",
       "      <td>47.9</td>\n",
       "    </tr>\n",
       "    <tr>\n",
       "      <th>60</th>\n",
       "      <td>79.31</td>\n",
       "      <td>0.0026</td>\n",
       "      <td>7</td>\n",
       "      <td>7</td>\n",
       "      <td>0.0</td>\n",
       "      <td>4</td>\n",
       "      <td>4.436621</td>\n",
       "      <td>19.58</td>\n",
       "    </tr>\n",
       "    <tr>\n",
       "      <th>69</th>\n",
       "      <td>50.73</td>\n",
       "      <td>0.4502</td>\n",
       "      <td>8</td>\n",
       "      <td>8</td>\n",
       "      <td>3.36</td>\n",
       "      <td>5</td>\n",
       "      <td>4.436621</td>\n",
       "      <td>18.73</td>\n",
       "    </tr>\n",
       "    <tr>\n",
       "      <th>79</th>\n",
       "      <td>37.69</td>\n",
       "      <td>0.3584</td>\n",
       "      <td>4</td>\n",
       "      <td>4</td>\n",
       "      <td>0.93</td>\n",
       "      <td>3</td>\n",
       "      <td>3.327466</td>\n",
       "      <td>0.0</td>\n",
       "    </tr>\n",
       "    <tr>\n",
       "      <th>105</th>\n",
       "      <td>69.42</td>\n",
       "      <td>0.4041</td>\n",
       "      <td>7</td>\n",
       "      <td>7</td>\n",
       "      <td>1.33</td>\n",
       "      <td>3</td>\n",
       "      <td>2.936159</td>\n",
       "      <td>13.21</td>\n",
       "    </tr>\n",
       "    <tr>\n",
       "      <th>...</th>\n",
       "      <td>...</td>\n",
       "      <td>...</td>\n",
       "      <td>...</td>\n",
       "      <td>...</td>\n",
       "      <td>...</td>\n",
       "      <td>...</td>\n",
       "      <td>...</td>\n",
       "      <td>...</td>\n",
       "    </tr>\n",
       "    <tr>\n",
       "      <th>25485</th>\n",
       "      <td>63.46</td>\n",
       "      <td>0.2645</td>\n",
       "      <td>4</td>\n",
       "      <td>4</td>\n",
       "      <td>0.18</td>\n",
       "      <td>10</td>\n",
       "      <td>8.646981</td>\n",
       "      <td>1.31</td>\n",
       "    </tr>\n",
       "    <tr>\n",
       "      <th>25508</th>\n",
       "      <td>67.29</td>\n",
       "      <td>0.5715</td>\n",
       "      <td>1</td>\n",
       "      <td>1</td>\n",
       "      <td>0.43</td>\n",
       "      <td>19</td>\n",
       "      <td>16.429264</td>\n",
       "      <td>0.66</td>\n",
       "    </tr>\n",
       "    <tr>\n",
       "      <th>25535</th>\n",
       "      <td>55.57</td>\n",
       "      <td>0.1114</td>\n",
       "      <td>11</td>\n",
       "      <td>8</td>\n",
       "      <td>0.29</td>\n",
       "      <td>4</td>\n",
       "      <td>3.458792</td>\n",
       "      <td>8.51</td>\n",
       "    </tr>\n",
       "    <tr>\n",
       "      <th>25536</th>\n",
       "      <td>61.42</td>\n",
       "      <td>0.1031</td>\n",
       "      <td>3</td>\n",
       "      <td>3</td>\n",
       "      <td>0.05</td>\n",
       "      <td>1</td>\n",
       "      <td>0.864698</td>\n",
       "      <td>10.87</td>\n",
       "    </tr>\n",
       "    <tr>\n",
       "      <th>25620</th>\n",
       "      <td>65.08</td>\n",
       "      <td>0.3406</td>\n",
       "      <td>4</td>\n",
       "      <td>3</td>\n",
       "      <td>0.05</td>\n",
       "      <td>6</td>\n",
       "      <td>5.188189</td>\n",
       "      <td>10.91</td>\n",
       "    </tr>\n",
       "  </tbody>\n",
       "</table>\n",
       "<p>1931 rows × 8 columns</p>\n",
       "</div>"
      ],
      "text/plain": [
       "       Age at Surgical Procedure  Fraction Genome Altered  Met Count  \\\n",
       "44                         71.17                   0.2474          4   \n",
       "60                         79.31                   0.0026          7   \n",
       "69                         50.73                   0.4502          8   \n",
       "79                         37.69                   0.3584          4   \n",
       "105                        69.42                   0.4041          7   \n",
       "...                          ...                      ...        ...   \n",
       "25485                      63.46                   0.2645          4   \n",
       "25508                      67.29                   0.5715          1   \n",
       "25535                      55.57                   0.1114         11   \n",
       "25536                      61.42                   0.1031          3   \n",
       "25620                      65.08                   0.3406          4   \n",
       "\n",
       "       Met Site Count  MSI Score  Mutation Count  TMB (nonsynonymous)  \\\n",
       "44                  4       0.44              15             16.63733   \n",
       "60                  7        0.0               4             4.436621   \n",
       "69                  8       3.36               5             4.436621   \n",
       "79                  4       0.93               3             3.327466   \n",
       "105                 7       1.33               3             2.936159   \n",
       "...               ...        ...             ...                  ...   \n",
       "25485               4       0.18              10             8.646981   \n",
       "25508               1       0.43              19            16.429264   \n",
       "25535               8       0.29               4             3.458792   \n",
       "25536               3       0.05               1             0.864698   \n",
       "25620               3       0.05               6             5.188189   \n",
       "\n",
       "       Sobrevivencia (Meses)  \n",
       "44                      47.9  \n",
       "60                     19.58  \n",
       "69                     18.73  \n",
       "79                       0.0  \n",
       "105                    13.21  \n",
       "...                      ...  \n",
       "25485                   1.31  \n",
       "25508                   0.66  \n",
       "25535                   8.51  \n",
       "25536                  10.87  \n",
       "25620                  10.91  \n",
       "\n",
       "[1931 rows x 8 columns]"
      ]
     },
     "execution_count": 8,
     "metadata": {},
     "output_type": "execute_result"
    }
   ],
   "source": [
    "df"
   ]
  },
  {
   "cell_type": "markdown",
   "id": "37ddec05-349c-4dfc-a302-a980c285cab1",
   "metadata": {},
   "source": [
    "<p style=\"text-align:justify;\"> Estudando o artigo de referência que disponibilou o dataset utilizado para encontrar o modelo que melhor descreve a sobrevida de um paciente de câncer de pulmão de células não pequenas,$\\textit{Non-Small Cell Lung}$, separou-se as colunas de atributos mostradas no tópico anterior. Contudo, para evitar um custo computacional desnecessário, será selecionado atributos que não apresentem multicolinearidade, ou seja, não é possível com uma combinação linear de atributos prever um outro. Isso será realizado com a seleção de atributos pelo fator de inflação de variância (VIF), desse modo, evita-se dados redundantes e cada operação realizada pelo modelo será relevante para encontrar o targer proposto.  \n",
    "\n",
    "<p style=\"text-align:justify;\"><strong>Antes de começar a gerar os modelos, vale notar que o modelo regressor não tem erro associado do modelo classificador, pois os dados que foram treinados nesse notebook não são os que ele apontou como não curados, são os pacientes do dataset original que apresentaram uma sobrevida de até 60 meses.</strong>"
   ]
  },
  {
   "cell_type": "markdown",
   "id": "f89fb9ad-99b8-4568-a729-a3dc2a5a0ddc",
   "metadata": {},
   "source": [
    "#### Separando dados de treino e teste"
   ]
  },
  {
   "cell_type": "markdown",
   "id": "834d322d-281b-4b52-86cc-4132de579b47",
   "metadata": {},
   "source": [
    "<p style=\"text-align:justify;\"> Separa-se dados de treino e de teste para avaliar a performance do trabalho desenvolvido. Mesmo com o tratamento de dados utilizados, ainda há muitos dados para serem utilizados, desse modo, mostra-se suficiente um teste que represente 10% das observações que o dataset base para o modelo possui."
   ]
  },
  {
   "cell_type": "code",
   "execution_count": 9,
   "id": "88c34c0f-5b13-408c-9a7f-7aabd5ada7fc",
   "metadata": {},
   "outputs": [],
   "source": [
    "from sklearn.model_selection import train_test_split\n",
    "\n",
    "TAMANHO_TESTE = 0.1\n",
    "SEMENTE_ALEATORIA = 61455\n",
    "\n",
    "indices = df.index\n",
    "indices_treino, indices_teste = train_test_split(\n",
    "    indices, test_size=TAMANHO_TESTE, random_state=SEMENTE_ALEATORIA\n",
    ")\n",
    "\n",
    "df_treino = df.loc[indices_treino]\n",
    "df_teste = df.loc[indices_teste]\n",
    "\n",
    "X_treino = df_treino.reindex(ATRIBUTOS, axis=1).values\n",
    "y_treino = df_treino.reindex(TARGET, axis=1).values.ravel()\n",
    "\n",
    "X_teste = df_teste.reindex(ATRIBUTOS, axis=1).values\n",
    "y_teste = df_teste.reindex(TARGET, axis=1).values.ravel()"
   ]
  },
  {
   "cell_type": "markdown",
   "id": "542c84f5-cb1f-4547-ae9a-6a33e4cad880",
   "metadata": {},
   "source": [
    "#### Seleção de atributos pelo fator de inflação de variância (VIF)"
   ]
  },
  {
   "cell_type": "markdown",
   "id": "f0ddc838-b3c3-4789-8fde-58675334d8bc",
   "metadata": {},
   "source": [
    "O **fator de inflação de variância** (*variance inflation factor*) é um algoritmo que encontra a multicolinearidade de um conjunto de dados. Os passos a seguir desse código foram descritos pelo professor Daniel Cassar:\n",
    "\n",
    "1.  Escolha o valor do limiar do $\\mathrm{VIF}$.\n",
    "\n",
    "<p>Observação: Escolheu-se o menos rigoroso, valor de limiar 10, pois esses atributos já foram selecionados de acordo com o bom senso para modelar o fenômeno e, ao fim, obtemos poucas colunas. Além disso, após essa etapa, há as operações algébricas que o próprio código realiza, não há mais escolha pensada no nosso problema.</p>\n",
    "   \n",
    "2.  Para cada atributo disponível, considere ele como target e treine um modelo linear com os atributos restantes. Registre o valor $\\mathrm{VIF}$ deste modelo sendo que $\\mathrm{VIF} = 1 / (1 - R^2)$.\n",
    "\n",
    "3.  Se pelo menos um dos valores $\\mathrm{VIF}$ observados no passo 2 for maior que o limiar definido no passo 1, vá ao passo seguinte. Do contrário, encerre o processo.\n",
    "\n",
    "5.  Remova o atributo de maior valor $\\mathrm{VIF}$ e retorne ao passo 2."
   ]
  },
  {
   "cell_type": "code",
   "execution_count": 10,
   "id": "df3df8ce-3c29-497e-a58b-b8211b6271a7",
   "metadata": {},
   "outputs": [],
   "source": [
    "from sklearn.ensemble import RandomForestRegressor\n",
    "\n",
