      "[I 2024-11-17 13:10:07,631] Trial 191 finished with value: 12.042149910895283 and parameters: {'vizinhos': 20, 'pesos': 'distance', 'parametro_potencia': 4.5548406376603925}. Best is trial 163 with value: 12.017840714433753.\n",
      "[I 2024-11-17 13:10:08,683] Trial 192 finished with value: 12.026429302059006 and parameters: {'vizinhos': 20, 'pesos': 'uniform', 'parametro_potencia': 5.106964035360794}. Best is trial 163 with value: 12.017840714433753.\n",
      "[I 2024-11-17 13:10:09,676] Trial 193 finished with value: 12.020141140818073 and parameters: {'vizinhos': 20, 'pesos': 'uniform', 'parametro_potencia': 4.728501219522299}. Best is trial 163 with value: 12.017840714433753.\n",
      "[I 2024-11-17 13:10:10,856] Trial 194 finished with value: 12.01995897928182 and parameters: {'vizinhos': 20, 'pesos': 'uniform', 'parametro_potencia': 4.789683311851869}. Best is trial 163 with value: 12.017840714433753.\n",
      "[I 2024-11-17 13:10:11,746] Trial 195 finished with value: 12.425275953994847 and parameters: {'vizinhos': 8, 'pesos': 'uniform', 'parametro_potencia': 4.906059308365663}. Best is trial 163 with value: 12.017840714433753.\n",
      "[I 2024-11-17 13:10:12,743] Trial 196 finished with value: 12.01980292719443 and parameters: {'vizinhos': 20, 'pesos': 'uniform', 'parametro_potencia': 4.790681043736763}. Best is trial 163 with value: 12.017840714433753.\n",
      "[I 2024-11-17 13:10:13,776] Trial 197 finished with value: 12.021042524798963 and parameters: {'vizinhos': 20, 'pesos': 'uniform', 'parametro_potencia': 4.563978385516131}. Best is trial 163 with value: 12.017840714433753.\n",
      "[I 2024-11-17 13:10:14,757] Trial 198 finished with value: 12.047081262019802 and parameters: {'vizinhos': 19, 'pesos': 'uniform', 'parametro_potencia': 5.005800419521604}. Best is trial 163 with value: 12.017840714433753.\n",
      "[I 2024-11-17 13:10:15,846] Trial 199 finished with value: 12.023215837922137 and parameters: {'vizinhos': 20, 'pesos': 'uniform', 'parametro_potencia': 4.400865834146311}. Best is trial 163 with value: 12.017840714433753.\n",
      "[I 2024-11-17 13:10:16,867] Trial 200 finished with value: 12.024654263908953 and parameters: {'vizinhos': 20, 'pesos': 'uniform', 'parametro_potencia': 5.186771306382403}. Best is trial 163 with value: 12.017840714433753.\n",
      "[I 2024-11-17 13:10:17,919] Trial 201 finished with value: 12.047349154061727 and parameters: {'vizinhos': 19, 'pesos': 'uniform', 'parametro_potencia': 4.796941109855242}. Best is trial 163 with value: 12.017840714433753.\n"
     ]
    }
   ],
   "source": [
    "NUM_TENTATIVAS = 200\n",
    "\n",
    "objeto_de_estudo.optimize(funcao_objetivo_parcial, n_trials=NUM_TENTATIVAS)"
   ]
  },
  {
   "cell_type": "code",
   "execution_count": 34,
   "id": "7c7b3e12-7a3a-40aa-81da-cfcf947c8b69",
   "metadata": {},
   "outputs": [
    {
     "name": "stdout",
     "output_type": "stream",
     "text": [
      "Número do melhor trial: 163\n",
      "Parâmetros do melhor trial: {'vizinhos': 20, 'pesos': 'uniform', 'parametro_potencia': 4.707739692974665}\n"
     ]
    }
   ],
   "source": [
    "melhor_trial = objeto_de_estudo.best_trial\n",
    "\n",
    "print(f\"Número do melhor trial: {melhor_trial.number}\")\n",
    "print(f\"Parâmetros do melhor trial: {melhor_trial.params}\")"
   ]
  },
  {
   "cell_type": "markdown",
   "id": "6e719e73-af00-4b23-9cef-5fb6042d19e1",
   "metadata": {},
   "source": [
    "### Estimando a performance do modelo KNN"
   ]
  },
  {
   "cell_type": "code",
   "execution_count": 35,
   "id": "dc685337-a084-47c5-8c2f-66d334d29c0e",
   "metadata": {},
   "outputs": [
    {
     "name": "stdout",
     "output_type": "stream",
     "text": [
      "As métricas foram: [-12.96641637 -14.28269458 -12.98670304 -13.77526908 -13.27256135\n",
      " -13.74230308 -14.76237202 -14.68992076 -15.53347737 -15.66091959\n",
      " -16.18437657 -16.48036195 -14.3541207  -15.12470355 -13.64973125\n",
      " -14.29325765 -14.15535944 -13.66711562 -13.43344439 -12.52092496\n",
      " -12.25026824 -11.40833176 -11.18876608 -10.90721526 -11.05124348\n",
      " -10.64862012  -9.62997693  -9.96292192  -8.84151588  -9.16327958\n",
      "  -8.77669209  -8.35959764  -8.29322372  -8.01413593  -8.38537479\n",
      "  -8.42896354  -8.55851447  -8.17734196  -8.34457865  -7.53583963]\n",
      "\n",
      "A média das métricas é de: 11.836560874518355\n"
     ]
    }
   ],
   "source": [
    "from sklearn.model_selection import cross_val_score\n",
    "\n",
    "NUM_FOLDS = 40\n",
    "SEMENTE_ALEATORIA = 20404\n",
    "modelo_ad = cria_instancia_modelo(melhor_trial)\n",
    "\n",
    "metricas = cross_val_score(\n",
    "    modelo_ad,    #instancia\n",
    "    X,            #dados de atributos\n",
    "    y,            #dados de target\n",
    "    cv=NUM_FOLDS, #número de folds\n",
    "    scoring=\"neg_root_mean_squared_error\", #quanto maior, melhor pelo scikit\n",
    ")\n",
    "\n",
    "print(\"As métricas foram:\", metricas)\n",
    "print()\n",
    "print(\"A média das métricas é de:\", np.abs(metricas.mean()))"
   ]
  },
  {
   "cell_type": "markdown",
   "id": "710679f2-4164-45cd-a95e-740af360faad",
   "metadata": {},
   "source": [
    "### Conclusão\n",
    "\n",
    "<p style=\"text-align:justify;\"> Ao encontrar o RMSE do baseline, temos um ponto de partida, ou seja, sabe-se que qualquer modelo que apresente um RMSE, a métrica de performance que escolhemos utilizar,  maior que esse valor não nos gera um bom modelo. A partir desse ponto, começou-se o estudo para selecionar atributos, o que utilizamos a técnica de seleção de atributos pelo fator de inflação de variância (VIF), assim como escolher o melhor conjunto de hiperparâmetros pelo optuna. Ademais, a seleção de melhores atributos foi realizada de acordo com os dois modelos avaliados: floresta aleatória e KNN. Com a métrica de performande de cada um desses modelos, pode-se observar o esperado: os resultados são muito próximos, até próximo do próprio baseline, isso significa que os dados que estamos lidando são bastante difíceis de serem preditos e que há bastante estudo para ser realizado ainda, desde acrescentar mais atributos acerca do paciente, até encontrar novos modelos que consigam lidar com a variabilidade muito sucinta sobre a saúde de um paciente. Contudo, precisou-se escolher um modelo e o que ainda apresentou o menor RMSE foi o regressor de floresta aleatória."
   ]
  },
  {
   "cell_type": "markdown",
   "id": "0ad8df15-77a9-4cfd-85e8-a7eaae4ef8ca",
   "metadata": {},
   "source": [
    "### Referências"
   ]
  },
  {
   "cell_type": "markdown",
   "id": "b721b3c5-3e43-438c-981b-8afefe06d23b",
   "metadata": {},
   "source": [
    "<p style=\"text-align:justify;\">[1] Nguyen, Bastien, Christopher Fong, Anisha Luthra, Shaleigh A. Smith, Renzo G. DiNatale, Subhiksha Nandakumar, Henry Walch, et al. “Genomic Characterization of Metastatic Patterns from Prospective Clinical Sequencing of 25,000 Patients”. Cell 185, nº 3 (3 de fevereiro de 2022): 563-575.e11. https://doi.org/10.1016/j.cell.2022.01.003.\n",
    "<p style=\"text-align:justify;\">[2] scikit-learn. “6.3. Preprocessing Data”. Acesso em 9 de outubro de 2024. https://scikit-learn/stable/modules/preprocessing.html.\n",
    "<p style=\"text-align:justify;\">[3] “ATP-203 1.1 - Tratamento de dados”. Acesso em 9 de outubro de 2024. \n",
    "<p style=\"text-align:justify;\">[4] \"ATP-203 2.1 - Aprendizado de máquina, k-NN e métricas\". Acesso em 16 de novembro de 2024.\n",
    "<p style=\"text-align:justify;\">[5] “ATP-203 5.1 - Floresta aleatória”. Acesso em 9 de outubro de 2024. \n",
    "<p style=\"text-align:justify;\">[6] \"ATP-203 6.1 - Otimização de hiperparâmetros com optuna\". Acesso em 16 de novembro de 2024.\n",
    "<p style=\"text-align:justify;\">[7] \"ATP-203 7.1 - Seleção de atributos\". Acesso em 16 de novembro de 2024.\n",
    "<p style=\"text-align:justify;\">[8] \"ATP-203 9.1 - Classificação binária\". Acesso em 10 de novembro de 2024. \n"
   ]
  }
 ],
 "metadata": {
  "kernelspec": {
   "display_name": "Python 3 (ipykernel)",
   "language": "python",
   "name": "python3"
  },
  "language_info": {
   "codemirror_mode": {
    "name": "ipython",
    "version": 3
   },
   "file_extension": ".py",
   "mimetype": "text/x-python",
   "name": "python",
   "nbconvert_exporter": "python",
   "pygments_lexer": "ipython3",
   "version": "3.12.3"
  }
 },
 "nbformat": 4,
 "nbformat_minor": 5
}
