      "[I 2024-11-17 13:06:44,953] Trial 399 finished with value: 11.944091649407653 and parameters: {'num_arvores': 437, 'critério': 'poisson', 'min_exemplos_split': 10, 'min_exemplos_folha': 11, 'num_max_atributos': 0.4294883882710355}. Best is trial 285 with value: 11.928484765389639.\n"
     ]
    }
   ],
   "source": [
    "NUM_TENTATIVAS = 200\n",
    "\n",
    "objeto_de_estudo.optimize(funcao_objetivo_parcial, n_trials=NUM_TENTATIVAS)"
   ]
  },
  {
   "cell_type": "code",
   "execution_count": 22,
   "id": "f9f29e43-3e0b-4941-93c0-e924d6ac70aa",
   "metadata": {},
   "outputs": [
    {
     "name": "stdout",
     "output_type": "stream",
     "text": [
      "Número do melhor trial: 285\n",
      "Parâmetros do melhor trial: {'num_arvores': 328, 'critério': 'poisson', 'min_exemplos_split': 33, 'min_exemplos_folha': 10, 'num_max_atributos': 0.373378161075968}\n"
     ]
    }
   ],
   "source": [
    "melhor_trial = objeto_de_estudo.best_trial\n",
    "\n",
    "print(f\"Número do melhor trial: {melhor_trial.number}\")\n",
    "print(f\"Parâmetros do melhor trial: {melhor_trial.params}\")"
   ]
  },
  {
   "cell_type": "markdown",
   "id": "c0efbebf-551f-4498-981c-ba938db57029",
   "metadata": {},
   "source": [
    "### Estimando a performance do modelo floresta aleatória"
   ]
  },
  {
   "cell_type": "markdown",
   "id": "1e845fc6-a9e3-4240-b3b9-ff0685017c8d",
   "metadata": {},
   "source": [
    "<p style=\"text-align:justify;\"> Nessa etapa, com os atributos que evitam multicolinearidade selecionados e os melhores hiperparâmentros encontrados pelo optuna, é momento de gerar o melhor modelo encontrado por esse conjunto de algorítmos. Para obter um bom estimador de performance do modelo, irá usar validação cruzada $k$​-fold.\n",
    "\n",
    "#### O RMSE obtido com os dados de teste separados anteriormente"
   ]
  },
  {
   "cell_type": "code",
   "execution_count": 23,
   "id": "abea73a5-114d-4254-a5fe-40b11bb33f2c",
   "metadata": {},
   "outputs": [
    {
     "name": "stdout",
     "output_type": "stream",
     "text": [
      "13.17116204335017\n"
     ]
    }
   ],
   "source": [
    "from sklearn.metrics import mean_squared_error\n",
    "\n",
    "modelo = cria_instancia_modelo(melhor_trial)\n",
    "modelo.fit(X_treino, y_treino)\n",
    "\n",
    "y_verdadeiro = y_teste\n",
    "y_previsao = modelo.predict(X_teste)\n",
    "\n",
    "RMSE = mean_squared_error(y_verdadeiro, y_previsao) ** (1/2)\n",
    "\n",
    "print(RMSE)"
   ]
  },
  {
   "cell_type": "markdown",
   "id": "115fbb51-7fc2-42df-822c-c4d4d533994d",
   "metadata": {},
   "source": [
    "#### Dados do documento de hiperparametros1"
   ]
  },
  {
   "cell_type": "code",
   "execution_count": 24,
   "id": "d9dfc73a-dcf7-4d8f-8ab3-3bb890db234d",
   "metadata": {},
   "outputs": [
    {
     "data": {
      "text/html": [
       "<div>\n",
       "<style scoped>\n",
       "    .dataframe tbody tr th:only-of-type {\n",
       "        vertical-align: middle;\n",
       "    }\n",
       "\n",
       "    .dataframe tbody tr th {\n",
       "        vertical-align: top;\n",
       "    }\n",
       "\n",
       "    .dataframe thead th {\n",
       "        text-align: right;\n",
       "    }\n",
       "</style>\n",
       "<table border=\"1\" class=\"dataframe\">\n",
       "  <thead>\n",
       "    <tr style=\"text-align: right;\">\n",
       "      <th></th>\n",
       "      <th>number</th>\n",
       "      <th>value</th>\n",
       "      <th>datetime_start</th>\n",
       "      <th>datetime_complete</th>\n",
       "      <th>duration</th>\n",
       "      <th>params_critério</th>\n",
       "      <th>params_min_exemplos_folha</th>\n",
       "      <th>params_min_exemplos_split</th>\n",
       "      <th>params_num_arvores</th>\n",
       "      <th>params_num_max_atributos</th>\n",
       "      <th>state</th>\n",
       "    </tr>\n",
       "  </thead>\n",
       "  <tbody>\n",
       "    <tr>\n",
       "      <th>0</th>\n",
       "      <td>0</td>\n",
       "      <td>11.954616</td>\n",
       "      <td>2024-11-17 11:29:15.052460</td>\n",
       "      <td>2024-11-17 11:29:20.809677</td>\n",
       "      <td>0 days 00:00:05.757217</td>\n",
       "      <td>poisson</td>\n",
       "      <td>42</td>\n",
       "      <td>20</td>\n",
       "      <td>113</td>\n",
       "      <td>0.875503</td>\n",
       "      <td>COMPLETE</td>\n",
       "    </tr>\n",
       "    <tr>\n",
       "      <th>1</th>\n",
       "      <td>1</td>\n",
       "      <td>12.072660</td>\n",
       "      <td>2024-11-17 11:29:20.917366</td>\n",
       "      <td>2024-11-17 11:29:25.695680</td>\n",
       "      <td>0 days 00:00:04.778314</td>\n",
       "      <td>friedman_mse</td>\n",
       "      <td>3</td>\n",
       "      <td>28</td>\n",
       "      <td>130</td>\n",
       "      <td>0.836091</td>\n",
       "      <td>COMPLETE</td>\n",
       "    </tr>\n",
       "    <tr>\n",
       "      <th>2</th>\n",
       "      <td>2</td>\n",
       "      <td>12.082239</td>\n",
       "      <td>2024-11-17 11:29:25.890589</td>\n",
       "      <td>2024-11-17 11:29:33.686342</td>\n",
       "      <td>0 days 00:00:07.795753</td>\n",
       "      <td>friedman_mse</td>\n",
       "      <td>7</td>\n",
       "      <td>3</td>\n",
       "      <td>234</td>\n",
       "      <td>0.783942</td>\n",
       "      <td>COMPLETE</td>\n",
       "    </tr>\n",
       "    <tr>\n",
       "      <th>3</th>\n",
       "      <td>3</td>\n",
       "      <td>11.945102</td>\n",
       "      <td>2024-11-17 11:29:33.776826</td>\n",
       "      <td>2024-11-17 11:29:37.250439</td>\n",
       "      <td>0 days 00:00:03.473613</td>\n",
       "      <td>poisson</td>\n",
       "      <td>36</td>\n",
       "      <td>27</td>\n",
       "      <td>115</td>\n",
       "      <td>0.203767</td>\n",
       "      <td>COMPLETE</td>\n",
       "    </tr>\n",
       "    <tr>\n",
       "      <th>4</th>\n",
       "      <td>4</td>\n",
       "      <td>12.119539</td>\n",
       "      <td>2024-11-17 11:29:37.307582</td>\n",
       "      <td>2024-11-17 11:29:44.570218</td>\n",
       "      <td>0 days 00:00:07.262636</td>\n",
       "      <td>squared_error</td>\n",
       "      <td>2</td>\n",
       "      <td>15</td>\n",
       "      <td>206</td>\n",
       "      <td>0.571657</td>\n",
       "      <td>COMPLETE</td>\n",
       "    </tr>\n",
       "    <tr>\n",
       "      <th>...</th>\n",
       "      <td>...</td>\n",
       "      <td>...</td>\n",
       "      <td>...</td>\n",
       "      <td>...</td>\n",
       "      <td>...</td>\n",
       "      <td>...</td>\n",
       "      <td>...</td>\n",
       "      <td>...</td>\n",
       "      <td>...</td>\n",
       "      <td>...</td>\n",
       "      <td>...</td>\n",
       "    </tr>\n",
       "    <tr>\n",
       "      <th>395</th>\n",
       "      <td>395</td>\n",
       "      <td>11.932867</td>\n",
       "      <td>2024-11-17 13:05:44.118682</td>\n",
       "      <td>2024-11-17 13:05:56.357188</td>\n",
       "      <td>0 days 00:00:12.238506</td>\n",
       "      <td>squared_error</td>\n",
       "      <td>8</td>\n",
       "      <td>48</td>\n",
       "      <td>456</td>\n",
       "      <td>0.313932</td>\n",
       "      <td>COMPLETE</td>\n",
       "    </tr>\n",
       "    <tr>\n",
       "      <th>396</th>\n",
       "      <td>396</td>\n",
       "      <td>11.938055</td>\n",
       "      <td>2024-11-17 13:05:56.401863</td>\n",
       "      <td>2024-11-17 13:06:08.404325</td>\n",
       "      <td>0 days 00:00:12.002462</td>\n",
       "      <td>poisson</td>\n",
       "      <td>10</td>\n",
       "      <td>35</td>\n",
       "      <td>442</td>\n",
       "      <td>0.404104</td>\n",
       "      <td>COMPLETE</td>\n",
       "    </tr>\n",
       "    <tr>\n",
       "      <th>397</th>\n",
       "      <td>397</td>\n",
       "      <td>11.941992</td>\n",
       "      <td>2024-11-17 13:06:08.448547</td>\n",
       "      <td>2024-11-17 13:06:19.898064</td>\n",
       "      <td>0 days 00:00:11.449517</td>\n",
       "      <td>friedman_mse</td>\n",
       "      <td>12</td>\n",
       "      <td>31</td>\n",
       "      <td>471</td>\n",
       "      <td>0.303859</td>\n",
       "      <td>COMPLETE</td>\n",
       "    </tr>\n",
       "    <tr>\n",
       "      <th>398</th>\n",
       "      <td>398</td>\n",
       "      <td>11.937504</td>\n",
       "      <td>2024-11-17 13:06:19.944476</td>\n",
       "      <td>2024-11-17 13:06:32.439157</td>\n",
       "      <td>0 days 00:00:12.494681</td>\n",
       "      <td>poisson</td>\n",
       "      <td>9</td>\n",
       "      <td>39</td>\n",
       "      <td>459</td>\n",
       "      <td>0.324261</td>\n",
       "      <td>COMPLETE</td>\n",
       "    </tr>\n",
       "    <tr>\n",
       "      <th>399</th>\n",
       "      <td>399</td>\n",
       "      <td>11.944092</td>\n",
       "      <td>2024-11-17 13:06:32.571625</td>\n",
       "      <td>2024-11-17 13:06:44.921678</td>\n",
       "      <td>0 days 00:00:12.350053</td>\n",
       "      <td>poisson</td>\n",
       "      <td>11</td>\n",
       "      <td>10</td>\n",
       "      <td>437</td>\n",
       "      <td>0.429488</td>\n",
       "      <td>COMPLETE</td>\n",
       "    </tr>\n",
       "  </tbody>\n",
       "</table>\n",
       "<p>400 rows × 11 columns</p>\n",
       "</div>"
      ],
      "text/plain": [
       "     number      value             datetime_start          datetime_complete  \\\n",
       "0         0  11.954616 2024-11-17 11:29:15.052460 2024-11-17 11:29:20.809677   \n",
       "1         1  12.072660 2024-11-17 11:29:20.917366 2024-11-17 11:29:25.695680   \n",
       "2         2  12.082239 2024-11-17 11:29:25.890589 2024-11-17 11:29:33.686342   \n",
       "3         3  11.945102 2024-11-17 11:29:33.776826 2024-11-17 11:29:37.250439   \n",
       "4         4  12.119539 2024-11-17 11:29:37.307582 2024-11-17 11:29:44.570218   \n",
       "..      ...        ...                        ...                        ...   \n",
       "395     395  11.932867 2024-11-17 13:05:44.118682 2024-11-17 13:05:56.357188   \n",
       "396     396  11.938055 2024-11-17 13:05:56.401863 2024-11-17 13:06:08.404325   \n",
       "397     397  11.941992 2024-11-17 13:06:08.448547 2024-11-17 13:06:19.898064   \n",
       "398     398  11.937504 2024-11-17 13:06:19.944476 2024-11-17 13:06:32.439157   \n",
       "399     399  11.944092 2024-11-17 13:06:32.571625 2024-11-17 13:06:44.921678   \n",
       "\n",
       "                  duration params_critério  params_min_exemplos_folha  \\\n",
       "0   0 days 00:00:05.757217         poisson                         42   \n",
       "1   0 days 00:00:04.778314    friedman_mse                          3   \n",
       "2   0 days 00:00:07.795753    friedman_mse                          7   \n",
       "3   0 days 00:00:03.473613         poisson                         36   \n",
       "4   0 days 00:00:07.262636   squared_error                          2   \n",
       "..                     ...             ...                        ...   \n",
       "395 0 days 00:00:12.238506   squared_error                          8   \n",
       "396 0 days 00:00:12.002462         poisson                         10   \n",
       "397 0 days 00:00:11.449517    friedman_mse                         12   \n",
       "398 0 days 00:00:12.494681         poisson                          9   \n",
       "399 0 days 00:00:12.350053         poisson                         11   \n",
       "\n",
       "     params_min_exemplos_split  params_num_arvores  params_num_max_atributos  \\\n",
       "0                           20                 113                  0.875503   \n",
       "1                           28                 130                  0.836091   \n",
       "2                            3                 234                  0.783942   \n",
       "3                           27                 115                  0.203767   \n",
       "4                           15                 206                  0.571657   \n",
       "..                         ...                 ...                       ...   \n",
       "395                         48                 456                  0.313932   \n",
       "396                         35                 442                  0.404104   \n",
       "397                         31                 471                  0.303859   \n",
       "398                         39                 459                  0.324261   \n",
       "399                         10                 437                  0.429488   \n",
       "\n",
       "        state  \n",
       "0    COMPLETE  \n",
       "1    COMPLETE  \n",
       "2    COMPLETE  \n",
       "3    COMPLETE  \n",
       "4    COMPLETE  \n",
       "..        ...  \n",
       "395  COMPLETE  \n",
       "396  COMPLETE  \n",
       "397  COMPLETE  \n",
       "398  COMPLETE  \n",
       "399  COMPLETE  \n",
       "\n",
       "[400 rows x 11 columns]"
      ]
     },
     "execution_count": 24,
     "metadata": {},
     "output_type": "execute_result"
    }
   ],
   "source": [
    "from optuna import load_study\n",
    "\n",
    "objeto_de_estudo_carregado = load_study(\n",
    "    study_name=NOME_DO_ESTUDO,\n",
    "    storage=f\"sqlite:///{NOME_DO_ESTUDO}.db\",\n",
    ")\n",
    "\n",
    "df = objeto_de_estudo_carregado.trials_dataframe()\n",
    "\n",
    "df"
   ]
  },
  {
   "cell_type": "markdown",
   "id": "a0f20ece-ccfa-4044-ac2f-c7acae019508",
   "metadata": {},
   "source": [
    "#### Avaliando a performance do modelo com a validação cruzada $k$​-fold."
   ]
  },
  {
   "cell_type": "code",
   "execution_count": 25,
   "id": "2ee6424a-95c2-4478-97d1-77acf64d4cbd",
   "metadata": {},
   "outputs": [
    {
     "name": "stdout",
     "output_type": "stream",
     "text": [
      "As métricas foram: [-12.89670078 -16.11619416 -11.10957974 -13.4543099  -13.57519612\n",
      " -16.8380261  -13.45529651 -14.61190863 -15.118844   -15.4672777\n",
      " -14.52041468 -17.19607671 -15.10624121 -14.2847592  -14.1621149\n",
      " -13.42099601 -15.75971273 -11.84707493 -14.59375272 -12.94824966\n",
      " -10.50731465 -13.61104373 -10.78060708 -11.84142377  -9.85744793\n",
      "  -9.40918286 -10.20486056 -10.11845952  -7.99859533  -8.4221797\n",
      "  -7.93004077  -8.50755913  -7.04860838  -6.87907781  -9.30820236\n",
      "  -9.54050682  -8.97646465  -8.03974466  -9.78089998  -8.16444229]\n",
      "\n",
      "A média das métricas é de: 11.835234709487974\n"
     ]
    }
   ],
   "source": [
    "from sklearn.model_selection import cross_val_score\n",
    "\n",
    "NUM_FOLDS = 40\n",
    "SEMENTE_ALEATORIA = 20404\n",
    "modelo_ad = cria_instancia_modelo(melhor_trial)\n",
    "\n",
    "metricas = cross_val_score(\n",
    "    modelo_ad,    #instância\n",
    "    X,            #dados de atributos\n",
    "    y,            #dados de target\n",
    "    cv=NUM_FOLDS, #número de folds\n",
    "    scoring=\"neg_root_mean_squared_error\", #quanto maior, melhor pelo scikit\n",
    ")\n",
    "\n",
    "print(\"As métricas foram:\", metricas)\n",
    "print()\n",
    "print(\"A média das métricas é de:\", np.abs(metricas.mean()))"
   ]
  },
  {
   "cell_type": "markdown",
   "id": "dbe8676d-d7d7-47c1-93b0-57631f0b68dc",
   "metadata": {},
   "source": [
    "## Otimizando hiperparâmetros com o optuna para o regressor KNN\n",
    "\n",
    "<p style=\"text-align:justify;\"> Nessa momento, irá realizar as mesmas operações passadas, contudo o estudo será dedicado para o modelo KNN e com todos os atributos selecionados sem o VIF. Se esse apresentar um RMSE menor que o regressor de floresta aleatória, será esse o modelo escolhido para realizar a predição de sobrevida de um paciente predito como não curado pelo <strong>modelo classificador</strong>.\n",
    "\n",
    "#### Partindo do mesmo dataset comentado inicialmente"
   ]
  },
  {
   "cell_type": "code",
   "execution_count": 26,
   "id": "20e10b06-6743-41e8-bca5-85e277ad4c0f",
   "metadata": {},
   "outputs": [],
   "source": [
    "df = pd.read_csv(\"msk_met_2021_clinical_data (1).tsv\", sep = \"\\t\")\n",
    "\n",
    "df['Curado'] = pd.NA\n",
    "df ['Sobrevivencia (Meses)'] = pd.NA\n",
    "\n",
    "for i, meses in enumerate(df['Overall Survival (Months)']):\n",
    "    \n",
    "    if meses >= 60:\n",
    "        df.loc [i, 'Curado'] = 1\n",
    "        \n",
    "    else:\n",
    "        if df.loc [i, 'Overall Survival Status'] == '1:DECEASED':\n",
    "            df.loc [i, 'Curado'] = 0\n",
    "            df.loc [i, 'Sobrevivencia (Meses)'] = meses\n",
    "\n",
    "df = df.reindex(ATRIBUTOS + TARGET, axis=1)\n",
    "df = df.dropna()\n",
    "df = df.convert_dtypes()"
   ]
  },
  {
   "cell_type": "markdown",
   "id": "7f5b4621-f271-4b5b-a078-b27e3e63b767",
   "metadata": {},
   "source": [
    "#### Separando dados de treino e teste"
   ]
  },
  {
   "cell_type": "code",
   "execution_count": 27,
   "id": "91e5a746-ce4d-4d48-b57f-d81d31cf7cee",
   "metadata": {},
   "outputs": [],
   "source": [
    "from sklearn.model_selection import train_test_split\n",
    "\n",
    "TAMANHO_TESTE = 0.1\n",
    "SEMENTE_ALEATORIA = 61455\n",
    "\n",
    "indices = df.index\n",
    "indices_treino, indices_teste = train_test_split(\n",
    "    indices, test_size=TAMANHO_TESTE, random_state=SEMENTE_ALEATORIA\n",
    ")\n",
    "\n",
    "df_treino = df.loc[indices_treino]\n",
    "df_teste = df.loc[indices_teste]\n",
    "\n",
    "X_treino = df_treino.reindex(ATRIBUTOS, axis=1).values\n",
    "y_treino = df_treino.reindex(TARGET, axis=1).values.ravel()\n",
    "\n",
    "X_teste = df_teste.reindex(ATRIBUTOS, axis=1).values\n",
    "y_teste = df_teste.reindex(TARGET, axis=1).values.ravel()\n",
    "\n",
    "X = df.reindex(ATRIBUTOS, axis=1).values\n",
    "y = df.reindex(TARGET, axis=1).values.ravel()"
   ]
  },
  {
   "cell_type": "markdown",
   "id": "b76e4cfe-470d-4fe6-a200-83041db98526",
   "metadata": {},
   "source": [
    "#### Normalizando os atributos de treino\n",
    "\n",
    "<p style=\"text-align:justify;\"> Normalizar os dados para serem treinados é uma característica do modelo KNN, então, nesse ponto, ele diferencia de como foi treinado o modelo anterior. Os dados tiveram uma normalização padrão."
   ]
  },
  {
   "cell_type": "code",
   "execution_count": 28,
   "id": "d9d373a3-4a54-405f-991f-8e9d4783035e",
   "metadata": {},
   "outputs": [],
   "source": [
    "from sklearn.preprocessing import StandardScaler\n",
    "normalizador = StandardScaler()\n",
    "normalizador.fit(X_treino)\n",
    "X_norm = normalizador.transform(X_treino)"
   ]
  },
  {
   "cell_type": "markdown",
   "id": "525fec05-285b-4eb5-9a4b-a03eccf8c76c",
   "metadata": {},
   "source": [
    "#### Criando as função de instaciar o modelo"
   ]
  },
  {
   "cell_type": "code",
   "execution_count": 29,
   "id": "629ab4d9-f9c1-4f29-9370-042232d40287",
   "metadata": {},
   "outputs": [],
   "source": [
    "from sklearn.neighbors import KNeighborsRegressor\n",
    "from sklearn.model_selection import cross_val_score\n",
    "\n",
    "def cria_instancia_modelo(trial):\n",
    "    \"\"\"Cria uma instância do modelo.\n",
    "\n",
    "    Args:\n",
    "      trial: objeto tipo Trial do optuna.\n",
    "\n",
    "    Returns:\n",
    "      Uma instância do modelo desejado.\n",
    "\n",
    "    \"\"\"\n",
    "    parametros = {\n",
    "        \"n_neighbors\": trial.suggest_int(\"vizinhos\", 4, 20),\n",
    "        \"weights\": trial.suggest_categorical(\n",
    "            \"pesos\", [\"uniform\", \"distance\"]\n",
    "        ),\n",
    "        \"p\": trial.suggest_float(\n",
    "            \"parametro_potencia\", 2, 10, log=True\n",
    "        )\n",
    "    }\n",
    "\n",
    "    model = KNeighborsRegressor(**parametros)\n",
    "\n",
    "    return model"
   ]
  },
  {
   "cell_type": "markdown",
   "id": "3fa96bce-1206-4c4a-9a7b-da23d30cbaef",
   "metadata": {},
   "source": [
    "#### Criando a função objetivo"
   ]
  },
  {
   "cell_type": "code",
   "execution_count": 30,
   "id": "b76f430d-93d3-4ddb-a372-b4b7869663bb",
   "metadata": {},
   "outputs": [],
   "source": [
    "from sklearn.model_selection import cross_val_score\n",
    "\n",
    "def funcao_objetivo(trial, X, y, num_folds):\n",
    "    \"\"\"Função objetivo do optuna\n",
    "\n",
    "    Referencia:\n",
    "      https://medium.com/@walter_sperat/ using-optuna-with-sklearn-the-right-way-part-1-6b4ad0ab2451\n",
    "\n",
    "    \"\"\"\n",
    "    modelo = cria_instancia_modelo(trial)\n",
    "\n",
    "    metricas = cross_val_score(\n",
    "        modelo,\n",
    "        X,\n",
    "        y,\n",
    "        scoring=\"neg_root_mean_squared_error\",\n",
    "        cv=num_folds,\n",
    "    )\n",
    "\n",
    "    return -metricas.mean()"
   ]
  },
  {
   "cell_type": "markdown",
   "id": "cab395e2-bfb9-499b-bbfa-4f654f3c0fb6",
   "metadata": {},
   "source": [
    "#### Criando o documento que irá salvar o estudo acrecar dos melhores hiperparâmetros para o KNN"
   ]
  },
  {
   "cell_type": "code",
   "execution_count": 31,
   "id": "41749b71-06ed-4ef7-94ea-bf25e31f9d18",
   "metadata": {},
   "outputs": [
    {
     "name": "stderr",
     "output_type": "stream",
     "text": [
      "[I 2024-11-17 13:06:54,326] Using an existing study with name 'KNN_comparativo' instead of creating a new one.\n"
     ]
    }
   ],
   "source": [
    "from optuna import create_study\n",
    "\n",
    "NOME_DO_ESTUDO = \"KNN_comparativo\"\n",
    "\n",
    "objeto_de_estudo = create_study(\n",
    "    direction=\"minimize\",\n",
    "    study_name=NOME_DO_ESTUDO,\n",
    "    storage=f\"sqlite:///{NOME_DO_ESTUDO}.db\",\n",
    "    load_if_exists=True,\n",
    ")"
   ]
  },
  {
   "cell_type": "ma