      "[I 2024-11-17 12:57:51,909] Trial 350 finished with value: 11.932344651519724 and parameters: {'num_arvores': 456, 'critério': 'poisson', 'min_exemplos_split': 40, 'min_exemplos_folha': 8, 'num_max_atributos': 0.4319646148565031}. Best is trial 285 with value: 11.928484765389639.\n",
      "[I 2024-11-17 12:58:03,093] Trial 351 finished with value: 11.933094516106001 and parameters: {'num_arvores': 414, 'critério': 'poisson', 'min_exemplos_split': 36, 'min_exemplos_folha': 9, 'num_max_atributos': 0.36762779812459906}. Best is trial 285 with value: 11.928484765389639.\n",
      "[I 2024-11-17 12:58:12,156] Trial 352 finished with value: 11.940674548027527 and parameters: {'num_arvores': 355, 'critério': 'friedman_mse', 'min_exemplos_split': 39, 'min_exemplos_folha': 11, 'num_max_atributos': 0.32407384916542853}. Best is trial 285 with value: 11.928484765389639.\n",
      "[I 2024-11-17 12:58:21,240] Trial 353 finished with value: 11.94229514270374 and parameters: {'num_arvores': 347, 'critério': 'poisson', 'min_exemplos_split': 33, 'min_exemplos_folha': 12, 'num_max_atributos': 0.42536059243674174}. Best is trial 285 with value: 11.928484765389639.\n",
      "[I 2024-11-17 12:58:33,879] Trial 354 finished with value: 11.940264310136445 and parameters: {'num_arvores': 456, 'critério': 'poisson', 'min_exemplos_split': 44, 'min_exemplos_folha': 8, 'num_max_atributos': 0.4177566282315998}. Best is trial 285 with value: 11.928484765389639.\n",
      "[I 2024-11-17 12:58:45,858] Trial 355 finished with value: 11.943933170400658 and parameters: {'num_arvores': 437, 'critério': 'poisson', 'min_exemplos_split': 37, 'min_exemplos_folha': 7, 'num_max_atributos': 0.4381608239374097}. Best is trial 285 with value: 11.928484765389639.\n",
      "[I 2024-11-17 12:58:58,227] Trial 356 finished with value: 11.938146548030375 and parameters: {'num_arvores': 452, 'critério': 'poisson', 'min_exemplos_split': 41, 'min_exemplos_folha': 13, 'num_max_atributos': 0.3865925413445551}. Best is trial 285 with value: 11.928484765389639.\n",
      "[I 2024-11-17 12:59:10,108] Trial 357 finished with value: 11.940197806101926 and parameters: {'num_arvores': 463, 'critério': 'poisson', 'min_exemplos_split': 34, 'min_exemplos_folha': 6, 'num_max_atributos': 0.46384235329091433}. Best is trial 285 with value: 11.928484765389639.\n",
      "[I 2024-11-17 12:59:22,851] Trial 358 finished with value: 11.935251014569399 and parameters: {'num_arvores': 448, 'critério': 'poisson', 'min_exemplos_split': 30, 'min_exemplos_folha': 9, 'num_max_atributos': 0.4030545745399957}. Best is trial 285 with value: 11.928484765389639.\n",
      "[I 2024-11-17 12:59:35,326] Trial 359 finished with value: 11.967103718078336 and parameters: {'num_arvores': 428, 'critério': 'poisson', 'min_exemplos_split': 39, 'min_exemplos_folha': 11, 'num_max_atributos': 0.508507474114922}. Best is trial 285 with value: 11.928484765389639.\n",
      "[I 2024-11-17 12:59:46,803] Trial 360 finished with value: 11.934841274730918 and parameters: {'num_arvores': 469, 'critério': 'poisson', 'min_exemplos_split': 48, 'min_exemplos_folha': 10, 'num_max_atributos': 0.3580166611422364}. Best is trial 285 with value: 11.928484765389639.\n",
      "[I 2024-11-17 12:59:59,465] Trial 361 finished with value: 11.943276944933649 and parameters: {'num_arvores': 456, 'critério': 'poisson', 'min_exemplos_split': 43, 'min_exemplos_folha': 9, 'num_max_atributos': 0.4829963852026478}. Best is trial 285 with value: 11.928484765389639.\n",
      "[I 2024-11-17 13:00:07,735] Trial 362 finished with value: 11.929167896387565 and parameters: {'num_arvores': 293, 'critério': 'poisson', 'min_exemplos_split': 36, 'min_exemplos_folha': 8, 'num_max_atributos': 0.43844883249071587}. Best is trial 285 with value: 11.928484765389639.\n",
      "[I 2024-11-17 13:00:16,238] Trial 363 finished with value: 11.93882277086934 and parameters: {'num_arvores': 295, 'critério': 'poisson', 'min_exemplos_split': 32, 'min_exemplos_folha': 7, 'num_max_atributos': 0.4248221506252926}. Best is trial 285 with value: 11.928484765389639.\n",
      "[I 2024-11-17 13:00:23,718] Trial 364 finished with value: 11.93817830218255 and parameters: {'num_arvores': 267, 'critério': 'poisson', 'min_exemplos_split': 35, 'min_exemplos_folha': 10, 'num_max_atributos': 0.3792488478354201}. Best is trial 285 with value: 11.928484765389639.\n",
      "[I 2024-11-17 13:00:31,374] Trial 365 finished with value: 11.936005438950419 and parameters: {'num_arvores': 276, 'critério': 'poisson', 'min_exemplos_split': 37, 'min_exemplos_folha': 12, 'num_max_atributos': 0.4520278399899022}. Best is trial 285 with value: 11.928484765389639.\n",
      "[I 2024-11-17 13:00:40,035] Trial 366 finished with value: 11.939067374588143 and parameters: {'num_arvores': 328, 'critério': 'poisson', 'min_exemplos_split': 34, 'min_exemplos_folha': 9, 'num_max_atributos': 0.39984109166145715}. Best is trial 285 with value: 11.928484765389639.\n",
      "[I 2024-11-17 13:00:48,058] Trial 367 finished with value: 11.936409315804033 and parameters: {'num_arvores': 287, 'critério': 'poisson', 'min_exemplos_split': 38, 'min_exemplos_folha': 8, 'num_max_atributos': 0.4233525194896909}. Best is trial 285 with value: 11.928484765389639.\n",
      "[I 2024-11-17 13:00:56,350] Trial 368 finished with value: 11.934814573603385 and parameters: {'num_arvores': 310, 'critério': 'poisson', 'min_exemplos_split': 35, 'min_exemplos_folha': 8, 'num_max_atributos': 0.33961865452342976}. Best is trial 285 with value: 11.928484765389639.\n",
      "[I 2024-11-17 13:01:03,457] Trial 369 finished with value: 11.937912223609796 and parameters: {'num_arvores': 260, 'critério': 'poisson', 'min_exemplos_split': 39, 'min_exemplos_folha': 11, 'num_max_atributos': 0.4719258512095946}. Best is trial 285 with value: 11.928484765389639.\n",
      "[I 2024-11-17 13:01:11,400] Trial 370 finished with value: 11.938712228535573 and parameters: {'num_arvores': 296, 'critério': 'squared_error', 'min_exemplos_split': 45, 'min_exemplos_folha': 10, 'num_max_atributos': 0.37336315202283066}. Best is trial 285 with value: 11.928484765389639.\n",
      "[I 2024-11-17 13:01:22,076] Trial 371 finished with value: 11.950742950071465 and parameters: {'num_arvores': 381, 'critério': 'poisson', 'min_exemplos_split': 30, 'min_exemplos_folha': 7, 'num_max_atributos': 0.4377977886623305}. Best is trial 285 with value: 11.928484765389639.\n",
      "[I 2024-11-17 13:01:30,155] Trial 372 finished with value: 11.93622321172661 and parameters: {'num_arvores': 282, 'critério': 'poisson', 'min_exemplos_split': 32, 'min_exemplos_folha': 9, 'num_max_atributos': 0.4088011105387101}. Best is trial 285 with value: 11.928484765389639.\n",
      "[I 2024-11-17 13:01:42,737] Trial 373 finished with value: 11.938123784184917 and parameters: {'num_arvores': 446, 'critério': 'poisson', 'min_exemplos_split': 36, 'min_exemplos_folha': 6, 'num_max_atributos': 0.4923562611395377}. Best is trial 285 with value: 11.928484765389639.\n",
      "[I 2024-11-17 13:01:51,972] Trial 374 finished with value: 11.94194081795892 and parameters: {'num_arvores': 334, 'critério': 'poisson', 'min_exemplos_split': 41, 'min_exemplos_folha': 2, 'num_max_atributos': 0.39235616317680283}. Best is trial 285 with value: 11.928484765389639.\n",
      "[I 2024-11-17 13:02:03,008] Trial 375 finished with value: 11.943195683800711 and parameters: {'num_arvores': 460, 'critério': 'friedman_mse', 'min_exemplos_split': 38, 'min_exemplos_folha': 13, 'num_max_atributos': 0.45599253301706255}. Best is trial 285 with value: 11.928484765389639.\n",
      "[I 2024-11-17 13:02:15,480] Trial 376 finished with value: 11.952969727932816 and parameters: {'num_arvores': 438, 'critério': 'poisson', 'min_exemplos_split': 50, 'min_exemplos_folha': 9, 'num_max_atributos': 0.5183081862238806}. Best is trial 285 with value: 11.928484765389639.\n",
      "[I 2024-11-17 13:02:23,307] Trial 377 finished with value: 11.941639597752921 and parameters: {'num_arvores': 300, 'critério': 'poisson', 'min_exemplos_split': 42, 'min_exemplos_folha': 12, 'num_max_atributos': 0.4303798701629959}. Best is trial 285 with value: 11.928484765389639.\n",
      "[I 2024-11-17 13:02:34,932] Trial 378 finished with value: 11.94628212894047 and parameters: {'num_arvores': 465, 'critério': 'poisson', 'min_exemplos_split': 34, 'min_exemplos_folha': 10, 'num_max_atributos': 0.36059925158391365}. Best is trial 285 with value: 11.928484765389639.\n",
      "[I 2024-11-17 13:02:42,641] Trial 379 finished with value: 11.933126137486866 and parameters: {'num_arvores': 275, 'critério': 'poisson', 'min_exemplos_split': 45, 'min_exemplos_folha': 8, 'num_max_atributos': 0.4086919977194447}. Best is trial 285 with value: 11.928484765389639.\n",
      "[I 2024-11-17 13:02:55,124] Trial 380 finished with value: 11.93244141859556 and parameters: {'num_arvores': 455, 'critério': 'poisson', 'min_exemplos_split': 40, 'min_exemplos_folha': 8, 'num_max_atributos': 0.46873576113988963}. Best is trial 285 with value: 11.928484765389639.\n",
      "[I 2024-11-17 13:03:03,165] Trial 381 finished with value: 11.942208553774947 and parameters: {'num_arvores': 313, 'critério': 'poisson', 'min_exemplos_split': 36, 'min_exemplos_folha': 14, 'num_max_atributos': 0.4766727999160123}. Best is trial 285 with value: 11.928484765389639.\n",
      "[I 2024-11-17 13:03:16,217] Trial 382 finished with value: 11.940367076258234 and parameters: {'num_arvores': 452, 'critério': 'poisson', 'min_exemplos_split': 3, 'min_exemplos_folha': 10, 'num_max_atributos': 0.49492794479016583}. Best is trial 285 with value: 11.928484765389639.\n",
      "[I 2024-11-17 13:03:28,578] Trial 383 finished with value: 11.933131299645433 and parameters: {'num_arvores': 441, 'critério': 'poisson', 'min_exemplos_split': 40, 'min_exemplos_folha': 7, 'num_max_atributos': 0.4618889865721377}. Best is trial 285 with value: 11.928484765389639.\n",
      "[I 2024-11-17 13:03:37,738] Trial 384 finished with value: 11.93969966412653 and parameters: {'num_arvores': 344, 'critério': 'poisson', 'min_exemplos_split': 37, 'min_exemplos_folha': 11, 'num_max_atributos': 0.37630028040297026}. Best is trial 285 with value: 11.928484765389639.\n",
      "[I 2024-11-17 13:03:50,543] Trial 385 finished with value: 11.941564269221843 and parameters: {'num_arvores': 450, 'critério': 'poisson', 'min_exemplos_split': 33, 'min_exemplos_folha': 8, 'num_max_atributos': 0.39261196484936295}. Best is trial 285 with value: 11.928484765389639.\n",
      "[I 2024-11-17 13:04:03,379] Trial 386 finished with value: 11.93750428644706 and parameters: {'num_arvores': 459, 'critério': 'poisson', 'min_exemplos_split': 39, 'min_exemplos_folha': 9, 'num_max_atributos': 0.4492264787837511}. Best is trial 285 with value: 11.928484765389639.\n",
      "[I 2024-11-17 13:04:15,594] Trial 387 finished with value: 11.945694771883542 and parameters: {'num_arvores': 432, 'critério': 'poisson', 'min_exemplos_split': 29, 'min_exemplos_folha': 10, 'num_max_atributos': 0.41990031788788573}. Best is trial 285 with value: 11.928484765389639.\n",
      "[I 2024-11-17 13:04:30,280] Trial 388 finished with value: 11.994402461985477 and parameters: {'num_arvores': 467, 'critério': 'poisson', 'min_exemplos_split': 43, 'min_exemplos_folha': 6, 'num_max_atributos': 0.8575300202936003}. Best is trial 285 with value: 11.928484765389639.\n",
      "[I 2024-11-17 13:04:43,677] Trial 389 finished with value: 11.96680647523752 and parameters: {'num_arvores': 457, 'critério': 'poisson', 'min_exemplos_split': 36, 'min_exemplos_folha': 12, 'num_max_atributos': 0.5495638080795575}. Best is trial 285 with value: 11.928484765389639.\n",
      "[I 2024-11-17 13:04:55,922] Trial 390 finished with value: 11.932696238654852 and parameters: {'num_arvores': 444, 'critério': 'poisson', 'min_exemplos_split': 40, 'min_exemplos_folha': 8, 'num_max_atributos': 0.3180396527660833}. Best is trial 285 with value: 11.928484765389639.\n",
      "[I 2024-11-17 13:05:08,156] Trial 391 finished with value: 11.940546854929869 and parameters: {'num_arvores': 443, 'critério': 'poisson', 'min_exemplos_split': 45, 'min_exemplos_folha': 9, 'num_max_atributos': 0.2911376959450987}. Best is trial 285 with value: 11.928484765389639.\n",
      "[I 2024-11-17 13:05:20,738] Trial 392 finished with value: 11.935628330893385 and parameters: {'num_arvores': 449, 'critério': 'poisson', 'min_exemplos_split': 38, 'min_exemplos_folha': 7, 'num_max_atributos': 0.3533406561365762}. Best is trial 285 with value: 11.928484765389639.\n",
      "[I 2024-11-17 13:05:32,621] Trial 393 finished with value: 11.937250033104762 and parameters: {'num_arvores': 426, 'critério': 'poisson', 'min_exemplos_split': 33, 'min_exemplos_folha': 11, 'num_max_atributos': 0.3788656296895262}. Best is trial 285 with value: 11.928484765389639.\n",
      "[I 2024-11-17 13:05:44,106] Trial 394 finished with value: 11.942685177937458 and parameters: {'num_arvores': 466, 'critério': 'poisson', 'min_exemplos_split': 42, 'min_exemplos_folha': 9, 'num_max_atributos': 0.33616406798745546}. Best is trial 285 with value: 11.928484765389639.\n",
      "[I 2024-11-17 13:05:56,389] Trial 395 finished with value: 11.932866554365123 and parameters: {'num_arvores': 456, 'critério': 'squared_error', 'min_exemplos_split': 48, 'min_exemplos_folha': 8, 'num_max_atributos': 0.3139321896696408}. Best is trial 285 with value: 11.928484765389639.\n",
      "[I 2024-11-17 13:06:08,436] Trial 396 finished with value: 11.938055001998123 and parameters: {'num_arvores': 442, 'critério': 'poisson', 'min_exemplos_split': 35, 'min_exemplos_folha': 10, 'num_max_atributos': 0.4041036471153918}. Best is trial 285 with value: 11.928484765389639.\n",
      "[I 2024-11-17 13:06:19,930] Trial 397 finished with value: 11.941992115020389 and parameters: {'num_arvores': 471, 'critério': 'friedman_mse', 'min_exemplos_split': 31, 'min_exemplos_folha': 12, 'num_max_atributos': 0.30385943084946665}. Best is trial 285 with value: 11.928484765389639.\n",
      "[I 2024-11-17 13:06:32,559] Trial 398 finished with value: 11.937504286447059 and parameters: {'num_arvores': 459, 'critério': 'poisson', 'min_exemplos_split': 39, 'min_exemplos_folha': 9, 'num_max_atributos': 0.32426124012070484}. Best is trial 285 with value: 11.928484765389639.\n",
