      "[I 2024-11-17 12:32:25,795] Trial 200 finished with value: 11.932753768478443 and parameters: {'num_arvores': 477, 'critério': 'poisson', 'min_exemplos_split': 41, 'min_exemplos_folha': 8, 'num_max_atributos': 0.44678683680328635}. Best is trial 52 with value: 11.930406468948263.\n",
      "[I 2024-11-17 12:32:36,848] Trial 201 finished with value: 11.931911050495284 and parameters: {'num_arvores': 474, 'critério': 'poisson', 'min_exemplos_split': 41, 'min_exemplos_folha': 10, 'num_max_atributos': 0.4062213782860375}. Best is trial 52 with value: 11.930406468948263.\n",
      "[I 2024-11-17 12:32:48,070] Trial 202 finished with value: 11.932464448057745 and parameters: {'num_arvores': 474, 'critério': 'poisson', 'min_exemplos_split': 41, 'min_exemplos_folha': 8, 'num_max_atributos': 0.44557461174946233}. Best is trial 52 with value: 11.930406468948263.\n",
      "[I 2024-11-17 12:32:59,029] Trial 203 finished with value: 11.932123760085268 and parameters: {'num_arvores': 473, 'critério': 'poisson', 'min_exemplos_split': 41, 'min_exemplos_folha': 8, 'num_max_atributos': 0.4109025897017248}. Best is trial 52 with value: 11.930406468948263.\n",
      "[I 2024-11-17 12:33:09,958] Trial 204 finished with value: 11.932191216115971 and parameters: {'num_arvores': 471, 'critério': 'poisson', 'min_exemplos_split': 40, 'min_exemplos_folha': 8, 'num_max_atributos': 0.4465541014471877}. Best is trial 52 with value: 11.930406468948263.\n",
      "[I 2024-11-17 12:33:21,095] Trial 205 finished with value: 11.932859494241523 and parameters: {'num_arvores': 474, 'critério': 'poisson', 'min_exemplos_split': 40, 'min_exemplos_folha': 8, 'num_max_atributos': 0.4081735487459267}. Best is trial 52 with value: 11.930406468948263.\n",
      "[I 2024-11-17 12:33:32,552] Trial 206 finished with value: 11.934782763988768 and parameters: {'num_arvores': 477, 'critério': 'poisson', 'min_exemplos_split': 38, 'min_exemplos_folha': 8, 'num_max_atributos': 0.4094983980990676}. Best is trial 52 with value: 11.930406468948263.\n",
      "[I 2024-11-17 12:33:43,601] Trial 207 finished with value: 11.932984009435454 and parameters: {'num_arvores': 475, 'critério': 'poisson', 'min_exemplos_split': 39, 'min_exemplos_folha': 8, 'num_max_atributos': 0.4390374263662503}. Best is trial 52 with value: 11.930406468948263.\n",
      "[I 2024-11-17 12:33:54,782] Trial 208 finished with value: 11.93698407921652 and parameters: {'num_arvores': 475, 'critério': 'poisson', 'min_exemplos_split': 39, 'min_exemplos_folha': 9, 'num_max_atributos': 0.44305923642823436}. Best is trial 52 with value: 11.930406468948263.\n",
      "[I 2024-11-17 12:34:05,702] Trial 209 finished with value: 11.93999934534467 and parameters: {'num_arvores': 474, 'critério': 'poisson', 'min_exemplos_split': 43, 'min_exemplos_folha': 8, 'num_max_atributos': 0.40479704986144305}. Best is trial 52 with value: 11.930406468948263.\n",
      "[I 2024-11-17 12:34:16,761] Trial 210 finished with value: 11.937278416270065 and parameters: {'num_arvores': 480, 'critério': 'poisson', 'min_exemplos_split': 40, 'min_exemplos_folha': 9, 'num_max_atributos': 0.440943427026781}. Best is trial 52 with value: 11.930406468948263.\n",
      "[I 2024-11-17 12:34:27,719] Trial 211 finished with value: 11.938828804997023 and parameters: {'num_arvores': 466, 'critério': 'poisson', 'min_exemplos_split': 50, 'min_exemplos_folha': 8, 'num_max_atributos': 0.42894014411930365}. Best is trial 52 with value: 11.930406468948263.\n",
      "[I 2024-11-17 12:34:39,175] Trial 212 finished with value: 11.937602678650302 and parameters: {'num_arvores': 486, 'critério': 'poisson', 'min_exemplos_split': 42, 'min_exemplos_folha': 6, 'num_max_atributos': 0.4202583209457062}. Best is trial 52 with value: 11.930406468948263.\n",
      "[I 2024-11-17 12:34:50,252] Trial 213 finished with value: 11.938923318416677 and parameters: {'num_arvores': 480, 'critério': 'poisson', 'min_exemplos_split': 44, 'min_exemplos_folha': 8, 'num_max_atributos': 0.3926897900252271}. Best is trial 52 with value: 11.930406468948263.\n",
      "[I 2024-11-17 12:35:01,337] Trial 214 finished with value: 11.93650086034343 and parameters: {'num_arvores': 469, 'critério': 'poisson', 'min_exemplos_split': 39, 'min_exemplos_folha': 10, 'num_max_atributos': 0.44542419395917004}. Best is trial 52 with value: 11.930406468948263.\n",
      "[I 2024-11-17 12:35:12,484] Trial 215 finished with value: 11.93284098915718 and parameters: {'num_arvores': 485, 'critério': 'poisson', 'min_exemplos_split': 41, 'min_exemplos_folha': 8, 'num_max_atributos': 0.4040220022907936}. Best is trial 52 with value: 11.930406468948263.\n",
      "[I 2024-11-17 12:35:23,333] Trial 216 finished with value: 11.935322389965325 and parameters: {'num_arvores': 463, 'critério': 'poisson', 'min_exemplos_split': 41, 'min_exemplos_folha': 9, 'num_max_atributos': 0.4062421779591739}. Best is trial 52 with value: 11.930406468948263.\n",
      "[I 2024-11-17 12:35:27,470] Trial 217 finished with value: 11.942146372539703 and parameters: {'num_arvores': 143, 'critério': 'poisson', 'min_exemplos_split': 44, 'min_exemplos_folha': 10, 'num_max_atributos': 0.44141958168019935}. Best is trial 52 with value: 11.930406468948263.\n",
      "[I 2024-11-17 12:35:38,835] Trial 218 finished with value: 11.935168848756819 and parameters: {'num_arvores': 476, 'critério': 'poisson', 'min_exemplos_split': 38, 'min_exemplos_folha': 9, 'num_max_atributos': 0.41792111557423095}. Best is trial 52 with value: 11.930406468948263.\n",
      "[I 2024-11-17 12:35:50,710] Trial 219 finished with value: 11.935450078573226 and parameters: {'num_arvores': 482, 'critério': 'poisson', 'min_exemplos_split': 41, 'min_exemplos_folha': 6, 'num_max_atributos': 0.3908216358855605}. Best is trial 52 with value: 11.930406468948263.\n",
      "[I 2024-11-17 12:36:02,494] Trial 220 finished with value: 11.93493450427373 and parameters: {'num_arvores': 472, 'critério': 'poisson', 'min_exemplos_split': 38, 'min_exemplos_folha': 8, 'num_max_atributos': 0.4453047120153917}. Best is trial 52 with value: 11.930406468948263.\n",
      "[I 2024-11-17 12:36:15,369] Trial 221 finished with value: 11.961446569661511 and parameters: {'num_arvores': 488, 'critério': 'poisson', 'min_exemplos_split': 47, 'min_exemplos_folha': 8, 'num_max_atributos': 0.5017154519775188}. Best is trial 52 with value: 11.930406468948263.\n",
      "[I 2024-11-17 12:36:26,697] Trial 222 finished with value: 11.944517424544856 and parameters: {'num_arvores': 488, 'critério': 'poisson', 'min_exemplos_split': 45, 'min_exemplos_folha': 5, 'num_max_atributos': 0.45262851684006367}. Best is trial 52 with value: 11.930406468948263.\n",
      "[I 2024-11-17 12:36:37,754] Trial 223 finished with value: 11.939936341323321 and parameters: {'num_arvores': 484, 'critério': 'poisson', 'min_exemplos_split': 50, 'min_exemplos_folha': 10, 'num_max_atributos': 0.4218286720511128}. Best is trial 52 with value: 11.930406468948263.\n",
      "[I 2024-11-17 12:36:48,593] Trial 224 finished with value: 11.940362067619041 and parameters: {'num_arvores': 464, 'critério': 'poisson', 'min_exemplos_split': 42, 'min_exemplos_folha': 8, 'num_max_atributos': 0.44985113988125686}. Best is trial 52 with value: 11.930406468948263.\n",
      "[I 2024-11-17 12:36:59,573] Trial 225 finished with value: 11.936533726746761 and parameters: {'num_arvores': 477, 'critério': 'poisson', 'min_exemplos_split': 47, 'min_exemplos_folha': 9, 'num_max_atributos': 0.42362813046841175}. Best is trial 52 with value: 11.930406468948263.\n",
      "[I 2024-11-17 12:37:10,436] Trial 226 finished with value: 11.935512695856207 and parameters: {'num_arvores': 487, 'critério': 'squared_error', 'min_exemplos_split': 41, 'min_exemplos_folha': 7, 'num_max_atributos': 0.382056116206484}. Best is trial 52 with value: 11.930406468948263.\n",
      "[I 2024-11-17 12:37:21,470] Trial 227 finished with value: 11.940062365772608 and parameters: {'num_arvores': 471, 'critério': 'poisson', 'min_exemplos_split': 44, 'min_exemplos_folha': 6, 'num_max_atributos': 0.4863715639081789}. Best is trial 52 with value: 11.930406468948263.\n",
      "[I 2024-11-17 12:37:32,448] Trial 228 finished with value: 11.932871997025552 and parameters: {'num_arvores': 464, 'critério': 'poisson', 'min_exemplos_split': 37, 'min_exemplos_folha': 9, 'num_max_atributos': 0.40155304488281146}. Best is trial 52 with value: 11.930406468948263.\n",
      "[I 2024-11-17 12:37:43,326] Trial 229 finished with value: 11.932276709716337 and parameters: {'num_arvores': 461, 'critério': 'poisson', 'min_exemplos_split': 37, 'min_exemplos_folha': 10, 'num_max_atributos': 0.39642592108742875}. Best is trial 52 with value: 11.930406468948263.\n",
      "[I 2024-11-17 12:37:55,090] Trial 230 finished with value: 11.939875839644237 and parameters: {'num_arvores': 459, 'critério': 'poisson', 'min_exemplos_split': 37, 'min_exemplos_folha': 11, 'num_max_atributos': 0.41148264445847405}. Best is trial 52 with value: 11.930406468948263.\n",
      "[I 2024-11-17 12:38:05,756] Trial 231 finished with value: 11.933894080500309 and parameters: {'num_arvores': 461, 'critério': 'poisson', 'min_exemplos_split': 40, 'min_exemplos_folha': 10, 'num_max_atributos': 0.38871217475984793}. Best is trial 52 with value: 11.930406468948263.\n",
      "[I 2024-11-17 12:38:16,617] Trial 232 finished with value: 11.936135913776633 and parameters: {'num_arvores': 460, 'critério': 'poisson', 'min_exemplos_split': 39, 'min_exemplos_folha': 10, 'num_max_atributos': 0.3914741857797576}. Best is trial 52 with value: 11.930406468948263.\n",
      "[I 2024-11-17 12:38:27,655] Trial 233 finished with value: 11.932994355691482 and parameters: {'num_arvores': 465, 'critério': 'poisson', 'min_exemplos_split': 37, 'min_exemplos_folha': 9, 'num_max_atributos': 0.38076664998428367}. Best is trial 52 with value: 11.930406468948263.\n",
      "[I 2024-11-17 12:38:38,579] Trial 234 finished with value: 11.931841223827737 and parameters: {'num_arvores': 464, 'critério': 'poisson', 'min_exemplos_split': 37, 'min_exemplos_folha': 10, 'num_max_atributos': 0.38196610698530065}. Best is trial 52 with value: 11.930406468948263.\n",
      "[I 2024-11-17 12:38:49,573] Trial 235 finished with value: 11.932099036441285 and parameters: {'num_arvores': 465, 'critério': 'poisson', 'min_exemplos_split': 37, 'min_exemplos_folha': 10, 'num_max_atributos': 0.3885124191284078}. Best is trial 52 with value: 11.930406468948263.\n",
      "[I 2024-11-17 12:39:00,425] Trial 236 finished with value: 11.932540517380424 and parameters: {'num_arvores': 462, 'critério': 'poisson', 'min_exemplos_split': 37, 'min_exemplos_folha': 10, 'num_max_atributos': 0.3862209783057069}. Best is trial 52 with value: 11.930406468948263.\n",
      "[I 2024-11-17 12:39:11,469] Trial 237 finished with value: 11.940355912517038 and parameters: {'num_arvores': 462, 'critério': 'poisson', 'min_exemplos_split': 37, 'min_exemplos_folha': 11, 'num_max_atributos': 0.3758059802880455}. Best is trial 52 with value: 11.930406468948263.\n",
      "[I 2024-11-17 12:39:22,367] Trial 238 finished with value: 11.932276709716337 and parameters: {'num_arvores': 461, 'critério': 'poisson', 'min_exemplos_split': 37, 'min_exemplos_folha': 10, 'num_max_atributos': 0.38828495237979543}. Best is trial 52 with value: 11.930406468948263.\n",
      "[I 2024-11-17 12:39:33,182] Trial 239 finished with value: 11.937601640567273 and parameters: {'num_arvores': 460, 'critério': 'poisson', 'min_exemplos_split': 36, 'min_exemplos_folha': 10, 'num_max_atributos': 0.37769880716863546}. Best is trial 52 with value: 11.930406468948263.\n",
      "[I 2024-11-17 12:39:44,080] Trial 240 finished with value: 11.940355912517038 and parameters: {'num_arvores': 462, 'critério': 'poisson', 'min_exemplos_split': 37, 'min_exemplos_folha': 11, 'num_max_atributos': 0.40431593028430973}. Best is trial 52 with value: 11.930406468948263.\n",
      "[I 2024-11-17 12:39:55,128] Trial 241 finished with value: 11.935712980428296 and parameters: {'num_arvores': 468, 'critério': 'poisson', 'min_exemplos_split': 38, 'min_exemplos_folha': 9, 'num_max_atributos': 0.398569099560176}. Best is trial 52 with value: 11.930406468948263.\n",
      "[I 2024-11-17 12:40:06,180] Trial 242 finished with value: 11.935918575063656 and parameters: {'num_arvores': 471, 'critério': 'poisson', 'min_exemplos_split': 39, 'min_exemplos_folha': 12, 'num_max_atributos': 0.3778126439042223}. Best is trial 52 with value: 11.930406468948263.\n",
      "[I 2024-11-17 12:40:18,210] Trial 243 finished with value: 11.937441045543844 and parameters: {'num_arvores': 455, 'critério': 'poisson', 'min_exemplos_split': 36, 'min_exemplos_folha': 10, 'num_max_atributos': 0.39075877028752126}. Best is trial 52 with value: 11.930406468948263.\n",
      "[I 2024-11-17 12:40:29,358] Trial 244 finished with value: 11.93786603453541 and parameters: {'num_arvores': 472, 'critério': 'poisson', 'min_exemplos_split': 40, 'min_exemplos_folha': 9, 'num_max_atributos': 0.3459447352701369}. Best is trial 52 with value: 11.930406468948263.\n",
      "[I 2024-11-17 12:40:40,225] Trial 245 finished with value: 11.938262282023281 and parameters: {'num_arvores': 461, 'critério': 'poisson', 'min_exemplos_split': 36, 'min_exemplos_folha': 10, 'num_max_atributos': 0.4117198548550621}. Best is trial 52 with value: 11.930406468948263.\n",
      "[I 2024-11-17 12:40:51,158] Trial 246 finished with value: 11.934282545967644 and parameters: {'num_arvores': 472, 'critério': 'poisson', 'min_exemplos_split': 40, 'min_exemplos_folha': 12, 'num_max_atributos': 0.37147360852323513}. Best is trial 52 with value: 11.930406468948263.\n",
      "[I 2024-11-17 12:41:03,199] Trial 247 finished with value: 11.934778083491192 and parameters: {'num_arvores': 456, 'critério': 'poisson', 'min_exemplos_split': 38, 'min_exemplos_folha': 9, 'num_max_atributos': 0.40062219771151875}. Best is trial 52 with value: 11.930406468948263.\n",
      "[I 2024-11-17 12:41:08,821] Trial 248 finished with value: 11.949156248287553 and parameters: {'num_arvores': 200, 'critério': 'poisson', 'min_exemplos_split': 36, 'min_exemplos_folha': 10, 'num_max_atributos': 0.42014906416051934}. Best is trial 52 with value: 11.930406468948263.\n",
      "[I 2024-11-17 12:41:20,167] Trial 249 finished with value: 11.947099715055598 and parameters: {'num_arvores': 474, 'critério': 'poisson', 'min_exemplos_split': 16, 'min_exemplos_folha': 11, 'num_max_atributos': 0.38048716602181193}. Best is trial 52 with value: 11.930406468948263.\n",
      "[I 2024-11-17 12:41:33,130] Trial 250 finished with value: 11.978368445460505 and parameters: {'num_arvores': 466, 'critério': 'poisson', 'min_exemplos_split': 42, 'min_exemplos_folha': 9, 'num_max_atributos': 0.7744232475308319}. Best is trial 52 with value: 11.930406468948263.\n",
      "[I 2024-11-17 12:41:44,835] Trial 251 finished with value: 11.935489647201077 and parameters: {'num_arvores': 447, 'critério': 'poisson', 'min_exemplos_split': 39, 'min_exemplos_folha': 11, 'num_max_atributos': 0.4296556818036374}. Best is trial 52 with value: 11.930406468948263.\n",
      "[I 2024-11-17 12:41:56,049] Trial 252 finished with value: 11.934319494254519 and parameters: {'num_arvores': 477, 'critério': 'poisson', 'min_exemplos_split': 41, 'min_exemplos_folha': 9, 'num_max_atributos': 0.40347486854494335}. Best is trial 52 with value: 11.930406468948263.\n",
      "[I 2024-11-17 12:42:08,116] Trial 253 finished with value: 11.940412276432834 and parameters: {'num_arvores': 459, 'critério': 'poisson', 'min_exemplos_split': 43, 'min_exemplos_folha': 8, 'num_max_atributos': 0.3497429378728266}. Best is trial 52 with value: 11.930406468948263.\n",
      "[I 2024-11-17 12:42:19,113] Trial 254 finished with value: 11.9320116058733 and parameters: {'num_arvores': 468, 'critério': 'poisson', 'min_exemplos_split': 37, 'min_exemplos_folha': 10, 'num_max_atributos': 0.42768277819680217}. Best is trial 52 with value: 11.930406468948263.\n",
      "[I 2024-11-17 12:42:30,600] Trial 255 finished with value: 11.943080316869057 and parameters: {'num_arvores': 443, 'critério': 'poisson', 'min_exemplos_split': 34, 'min_exemplos_folha': 12, 'num_max_atributos': 0.39688002707805126}. Best is trial 52 with value: 11.930406468948263.\n",
      "[I 2024-11-17 12:42:36,915] Trial 256 finished with value: 11.941031919492959 and parameters: {'num_arvores': 217, 'critério': 'poisson', 'min_exemplos_split': 38, 'min_exemplos_folha': 10, 'num_max_atributos': 0.4188784272602357}. Best is trial 52 with value: 11.930406468948263.\n",
      "[I 2024-11-17 12:42:50,381] Trial 257 finished with value: 12.005874737488542 and parameters: {'num_arvores': 467, 'critério': 'poisson', 'min_exemplos_split': 36, 'min_exemplos_folha': 7, 'num_max_atributos': 0.9328773311453169}. Best is trial 52 with value: 11.930406468948263.\n",
      "[I 2024-11-17 12:43:02,300] Trial 258 finished with value: 11.940148037567083 and parameters: {'num_arvores': 458, 'critério': 'poisson', 'min_exemplos_split': 35, 'min_exemplos_folha': 12, 'num_max_atributos': 0.37033654678967615}. Best is trial 52 with value: 11.930406468948263.\n",
      "[I 2024-11-17 12:43:05,392] Trial 259 finished with value: 11.94885781193266 and parameters: {'num_arvores': 96, 'critério': 'squared_error', 'min_exemplos_split': 39, 'min_exemplos_folha': 10, 'num_max_atributos': 0.4282046858244552}. Best is trial 52 with value: 11.930406468948263.\n",
      "[I 2024-11-17 12:43:16,353] Trial 260 finished with value: 11.936036145843259 and parameters: {'num_arvores': 471, 'critério': 'poisson', 'min_exemplos_split': 44, 'min_exemplos_folha': 11, 'num_max_atributos': 0.38790022341842156}. Best is trial 52 with value: 11.930406468948263.\n",
      "[I 2024-11-17 12:43:28,339] Trial 261 finished with value: 11.935545006011955 and parameters: {'num_arvores': 453, 'critério': 'poisson', 'min_exemplos_split': 38, 'min_exemplos_folha': 7, 'num_max_atributos': 0.4084140800399012}. Best is trial 52 with value: 11.930406468948263.\n",
      "[I 2024-11-17 12:43:39,421] Trial 262 finished with value: 11.939775551720546 and parameters: {'num_arvores': 476, 'critério': 'poisson', 'min_exemplos_split': 43, 'min_exemplos_folha': 8, 'num_max_atributos': 0.4389673708734309}. Best is trial 52 with value: 11.930406468948263.\n",
      "[I 2024-11-17 12:43:50,545] Trial 263 finished with value: 11.935963586894216 and parameters: {'num_arvores': 466, 'critério': 'poisson', 'min_exemplos_split': 36, 'min_exemplos_folha': 9, 'num_max_atributos': 0.3657092457556161}. Best is trial 52 with value: 11.930406468948263.\n",
      "[I 2024-11-17 12:43:52,173] Trial 264 finished with value: 11.984558120680738 and parameters: {'num_arvores': 34, 'critério': 'poisson', 'min_exemplos_split': 40, 'min_exemplos_folha': 8, 'num_max_atributos': 0.4189903094665761}. Best is trial 52 with value: 11.930406468948263.\n",
      "[I 2024-11-17 12:44:03,642] Trial 265 finished with value: 11.93979874006742 and parameters: {'num_arvores': 441, 'critério': 'poisson', 'min_exemplos_split': 44, 'min_exemplos_folha': 10, 'num_max_atributos': 0.34325264112846865}. Best is trial 52 with value: 11.930406468948263.\n",
      "[I 2024-11-17 12:44:14,759] Trial 266 finished with value: 11.944558496562314 and parameters: {'num_arvores': 476, 'critério': 'poisson', 'min_exemplos_split': 34, 'min_exemplos_folha': 9, 'num_max_atributos': 0.40402724025870035}. Best is trial 52 with value: 11.930406468948263.\n",
      "[I 2024-11-17 12:44:26,877] Trial 267 finished with value: 11.931290494780832 and parameters: {'num_arvores': 452, 'critério': 'poisson', 'min_exemplos_split': 37, 'min_exemplos_folha': 10, 'num_max_atributos': 0.38198231646860037}. Best is trial 52 with value: 11.930406468948263.\n",
      "[I 2024-11-17 12:44:38,913] Trial 268 finished with value: 11.931290494780832 and parameters: {'num_arvores': 452, 'critério': 'poisson', 'min_exemplos_split': 37, 'min_exemplos_folha': 10, 'num_max_atributos': 0.3873047891356422}. Best is trial 52 with value: 11.930406468948263.\n",
      "[I 2024-11-17 12:44:50,889] Trial 269 finished with value: 11.939159549683424 and parameters: {'num_arvores': 452, 'critério': 'poisson', 'min_exemplos_split': 37, 'min_exemplos_folha': 11, 'num_max_atributos': 0.44584217207525595}. Best is trial 52 with value: 11.930406468948263.\n",
      "[I 2024-11-17 12:45:02,476] Trial 270 finished with value: 11.945231179748815 and parameters: {'num_arvores': 434, 'critério': 'poisson', 'min_exemplos_split': 34, 'min_exemplos_folha': 9, 'num_max_atributos': 0.37185655355195874}. Best is trial 52 with value: 11.930406468948263.\n",
      "[I 2024-11-17 12:45:14,301] Trial 271 finished with value: 11.943298889224165 and parameters: {'num_arvores': 447, 'critério': 'poisson', 'min_exemplos_split': 37, 'min_exemplos_folha': 7, 'num_max_atributos': 0.42295353798200963}. Best is trial 52 with value: 11.930406468948263.\n",
      "[I 2024-11-17 12:45:26,107] Trial 272 finished with value: 11.932699590049456 and parameters: {'num_arvores': 456, 'critério': 'poisson', 'min_exemplos_split': 41, 'min_exemplos_folha': 8, 'num_max_atributos': 0.3911414902724122}. Best is trial 52 with value: 11.930406468948263.\n",
      "[I 2024-11-17 12:45:36,977] Trial 273 finished with value: 11.940362067619041 and parameters: {'num_arvores': 464, 'critério': 'poisson', 'min_exemplos_split': 42, 'min_exemplos_folha': 8, 'num_max_atributos': 0.38907622824376337}. Best is trial 52 with value: 11.930406468948263.\n",
      "[I 2024-11-17 12:45:41,849] Trial 274 finished with value: 11.94515463565908 and parameters: {'num_arvores': 172, 'critério': 'poisson', 'min_exemplos_split': 39, 'min_exemplos_folha': 8, 'num_max_atributos': 0.37463847538219647}. Best is trial 52 with value: 11.930406468948263.\n",
