      "[I 2024-11-17 13:06:55,282] Trial 2 finished with value: 12.422505083415682 and parameters: {'vizinhos': 8, 'pesos': 'uniform', 'parametro_potencia': 4.960044756560448}. Best is trial 2 with value: 12.422505083415682.\n",
      "[I 2024-11-17 13:06:56,355] Trial 3 finished with value: 12.026096023720728 and parameters: {'vizinhos': 20, 'pesos': 'uniform', 'parametro_potencia': 5.632165303280377}. Best is trial 3 with value: 12.026096023720728.\n",
      "[I 2024-11-17 13:06:57,415] Trial 4 finished with value: 12.074772417778588 and parameters: {'vizinhos': 18, 'pesos': 'distance', 'parametro_potencia': 2.3383668145198904}. Best is trial 3 with value: 12.026096023720728.\n",
      "[I 2024-11-17 13:06:58,450] Trial 5 finished with value: 12.074964737297321 and parameters: {'vizinhos': 18, 'pesos': 'distance', 'parametro_potencia': 2.4456191716861646}. Best is trial 3 with value: 12.026096023720728.\n",
      "[I 2024-11-17 13:06:59,226] Trial 6 finished with value: 13.118372646022175 and parameters: {'vizinhos': 4, 'pesos': 'uniform', 'parametro_potencia': 6.7521543641670085}. Best is trial 3 with value: 12.026096023720728.\n",
      "[I 2024-11-17 13:07:00,078] Trial 7 finished with value: 12.60861531734615 and parameters: {'vizinhos': 7, 'pesos': 'distance', 'parametro_potencia': 4.628417541529922}. Best is trial 3 with value: 12.026096023720728.\n",
      "[I 2024-11-17 13:07:01,097] Trial 8 finished with value: 12.114880885314637 and parameters: {'vizinhos': 15, 'pesos': 'uniform', 'parametro_potencia': 4.806427441606818}. Best is trial 3 with value: 12.026096023720728.\n",
      "[I 2024-11-17 13:07:02,062] Trial 9 finished with value: 12.117661999696251 and parameters: {'vizinhos': 16, 'pesos': 'distance', 'parametro_potencia': 3.173596238647713}. Best is trial 3 with value: 12.026096023720728.\n",
      "[I 2024-11-17 13:07:02,944] Trial 10 finished with value: 12.335321242877564 and parameters: {'vizinhos': 10, 'pesos': 'distance', 'parametro_potencia': 5.038177751489533}. Best is trial 3 with value: 12.026096023720728.\n",
      "[I 2024-11-17 13:07:03,925] Trial 11 finished with value: 12.060189378864013 and parameters: {'vizinhos': 18, 'pesos': 'uniform', 'parametro_potencia': 6.779257560314171}. Best is trial 3 with value: 12.026096023720728.\n",
      "[I 2024-11-17 13:07:04,885] Trial 12 finished with value: 12.173859109831579 and parameters: {'vizinhos': 13, 'pesos': 'uniform', 'parametro_potencia': 9.452609293931335}. Best is trial 3 with value: 12.026096023720728.\n",
      "[I 2024-11-17 13:07:05,857] Trial 13 finished with value: 12.029237970583598 and parameters: {'vizinhos': 20, 'pesos': 'uniform', 'parametro_potencia': 7.380957934837936}. Best is trial 3 with value: 12.026096023720728.\n",
      "[I 2024-11-17 13:07:06,829] Trial 14 finished with value: 12.029162347963473 and parameters: {'vizinhos': 20, 'pesos': 'uniform', 'parametro_potencia': 7.583629832502427}. Best is trial 3 with value: 12.026096023720728.\n",
      "[I 2024-11-17 13:07:07,822] Trial 15 finished with value: 12.031162064694911 and parameters: {'vizinhos': 20, 'pesos': 'uniform', 'parametro_potencia': 9.981789989551459}. Best is trial 3 with value: 12.026096023720728.\n",
      "[I 2024-11-17 13:07:08,778] Trial 16 finished with value: 12.130434621284605 and parameters: {'vizinhos': 14, 'pesos': 'uniform', 'parametro_potencia': 3.510269329803857}. Best is trial 3 with value: 12.026096023720728.\n",
      "[I 2024-11-17 13:07:09,828] Trial 17 finished with value: 12.068261288088936 and parameters: {'vizinhos': 17, 'pesos': 'uniform', 'parametro_potencia': 6.056051234027514}. Best is trial 3 with value: 12.026096023720728.\n",
      "[I 2024-11-17 13:07:10,708] Trial 18 finished with value: 12.248081018593746 and parameters: {'vizinhos': 11, 'pesos': 'uniform', 'parametro_potencia': 8.255128936524484}. Best is trial 3 with value: 12.026096023720728.\n",
      "[I 2024-11-17 13:07:11,759] Trial 19 finished with value: 12.027227727225336 and parameters: {'vizinhos': 20, 'pesos': 'uniform', 'parametro_potencia': 3.6361704618556026}. Best is trial 3 with value: 12.026096023720728.\n",
      "[I 2024-11-17 13:07:12,756] Trial 20 finished with value: 12.084399280964218 and parameters: {'vizinhos': 16, 'pesos': 'uniform', 'parametro_potencia': 3.749047278025708}. Best is trial 3 with value: 12.026096023720728.\n",
      "[I 2024-11-17 13:07:13,696] Trial 21 finished with value: 12.156645069064412 and parameters: {'vizinhos': 13, 'pesos': 'uniform', 'parametro_potencia': 2.9061916630287685}. Best is trial 3 with value: 12.026096023720728.\n",
      "[I 2024-11-17 13:07:14,717] Trial 22 finished with value: 12.039983970007883 and parameters: {'vizinhos': 19, 'pesos': 'uniform', 'parametro_potencia': 4.0061581725384565}. Best is trial 3 with value: 12.026096023720728.\n",
      "[I 2024-11-17 13:07:15,694] Trial 23 finished with value: 12.026928288377603 and parameters: {'vizinhos': 20, 'pesos': 'uniform', 'parametro_potencia': 5.515302445591465}. Best is trial 3 with value: 12.026096023720728.\n",
      "[I 2024-11-17 13:07:16,679] Trial 24 finished with value: 12.027907542351693 and parameters: {'vizinhos': 20, 'pesos': 'uniform', 'parametro_potencia': 5.686601590531592}. Best is trial 3 with value: 12.026096023720728.\n",
      "[I 2024-11-17 13:07:17,692] Trial 25 finished with value: 12.069532220389547 and parameters: {'vizinhos': 17, 'pesos': 'uniform', 'parametro_potencia': 5.685512220986799}. Best is trial 3 with value: 12.026096023720728.\n",
      "[I 2024-11-17 13:07:18,754] Trial 26 finished with value: 12.041447717691149 and parameters: {'vizinhos': 19, 'pesos': 'uniform', 'parametro_potencia': 4.139946449608273}. Best is trial 3 with value: 12.026096023720728.\n",
      "[I 2024-11-17 13:07:19,942] Trial 27 finished with value: 12.085500837098829 and parameters: {'vizinhos': 16, 'pesos': 'uniform', 'parametro_potencia': 2.852086821026766}. Best is trial 3 with value: 12.026096023720728.\n",
      "[I 2024-11-17 13:07:20,918] Trial 28 finished with value: 12.078653027744434 and parameters: {'vizinhos': 18, 'pesos': 'distance', 'parametro_potencia': 4.318819115149066}. Best is trial 3 with value: 12.026096023720728.\n",
      "[I 2024-11-17 13:07:21,931] Trial 29 finished with value: 12.106414528447269 and parameters: {'vizinhos': 15, 'pesos': 'uniform', 'parametro_potencia': 3.399289959050585}. Best is trial 3 with value: 12.026096023720728.\n",
      "[I 2024-11-17 13:07:22,921] Trial 30 finished with value: 12.042600650055096 and parameters: {'vizinhos': 19, 'pesos': 'uniform', 'parametro_potencia': 5.4436396210722435}. Best is trial 3 with value: 12.026096023720728.\n",
      "[I 2024-11-17 13:07:23,872] Trial 31 finished with value: 12.421941159039845 and parameters: {'vizinhos': 8, 'pesos': 'uniform', 'parametro_potencia': 6.248913663215479}. Best is trial 3 with value: 12.026096023720728.\n",
      "[I 2024-11-17 13:07:25,026] Trial 32 finished with value: 12.07344316087872 and parameters: {'vizinhos': 17, 'pesos': 'uniform', 'parametro_potencia': 2.018132087130933}. Best is trial 3 with value: 12.026096023720728.\n",
      "[I 2024-11-17 13:07:26,001] Trial 33 finished with value: 12.021513311287599 and parameters: {'vizinhos': 20, 'pesos': 'uniform', 'parametro_potencia': 5.343868890171822}. Best is trial 33 with value: 12.021513311287599.\n",
      "[I 2024-11-17 13:07:26,971] Trial 34 finished with value: 12.047899745687532 and parameters: {'vizinhos': 19, 'pesos': 'uniform', 'parametro_potencia': 4.957382434523358}. Best is trial 33 with value: 12.021513311287599.\n",
      "[I 2024-11-17 13:07:28,105] Trial 35 finished with value: 12.021865346480476 and parameters: {'vizinhos': 20, 'pesos': 'uniform', 'parametro_potencia': 5.255408424815355}. Best is trial 33 with value: 12.021513311287599.\n",
      "[I 2024-11-17 13:07:29,164] Trial 36 finished with value: 12.065032933254152 and parameters: {'vizinhos': 19, 'pesos': 'distance', 'parametro_potencia': 5.129677815196462}. Best is trial 33 with value: 12.021513311287599.\n",
      "[I 2024-11-17 13:07:30,016] Trial 37 finished with value: 13.117416941397915 and parameters: {'vizinhos': 4, 'pesos': 'uniform', 'parametro_potencia': 6.144506351544797}. Best is trial 33 with value: 12.021513311287599.\n",
      "[I 2024-11-17 13:07:30,986] Trial 38 finished with value: 12.082825319301135 and parameters: {'vizinhos': 18, 'pesos': 'distance', 'parametro_potencia': 4.588793384046838}. Best is trial 33 with value: 12.021513311287599.\n",
      "[I 2024-11-17 13:07:32,008] Trial 39 finished with value: 12.065085841902636 and parameters: {'vizinhos': 17, 'pesos': 'uniform', 'parametro_potencia': 6.92029230034521}. Best is trial 33 with value: 12.021513311287599.\n",
      "[I 2024-11-17 13:07:32,844] Trial 40 finished with value: 12.564307869889962 and parameters: {'vizinhos': 7, 'pesos': 'uniform', 'parametro_potencia': 5.383782524278912}. Best is trial 33 with value: 12.021513311287599.\n",
      "[I 2024-11-17 13:07:33,867] Trial 41 finished with value: 12.082771282092224 and parameters: {'vizinhos': 18, 'pesos': 'distance', 'parametro_potencia': 4.582716784291182}. Best is trial 33 with value: 12.021513311287599.\n",
      "[I 2024-11-17 13:07:35,028] Trial 42 finished with value: 12.027952171822037 and parameters: {'vizinhos': 20, 'pesos': 'uniform', 'parametro_potencia': 7.944319221758495}. Best is trial 33 with value: 12.021513311287599.\n",
      "[I 2024-11-17 13:07:36,017] Trial 43 finished with value: 12.027820985321476 and parameters: {'vizinhos': 20, 'pesos': 'uniform', 'parametro_potencia': 3.8219282133633303}. Best is trial 33 with value: 12.021513311287599.\n",
      "[I 2024-11-17 13:07:37,064] Trial 44 finished with value: 12.045432777799235 and parameters: {'vizinhos': 19, 'pesos': 'uniform', 'parametro_potencia': 6.31882024986907}. Best is trial 33 with value: 12.021513311287599.\n",
      "[I 2024-11-17 13:07:38,113] Trial 45 finished with value: 12.060973781162637 and parameters: {'vizinhos': 18, 'pesos': 'uniform', 'parametro_potencia': 5.150690151236844}. Best is trial 33 with value: 12.021513311287599.\n",
      "[I 2024-11-17 13:07:39,178] Trial 46 finished with value: 12.02784416770928 and parameters: {'vizinhos': 20, 'pesos': 'uniform', 'parametro_potencia': 4.267900066723105}. Best is trial 33 with value: 12.021513311287599.\n",
      "[I 2024-11-17 13:07:40,178] Trial 47 finished with value: 12.047581996139058 and parameters: {'vizinhos': 19, 'pesos': 'uniform', 'parametro_potencia': 4.800705203301589}. Best is trial 33 with value: 12.021513311287599.\n",
      "[I 2024-11-17 13:07:41,152] Trial 48 finished with value: 12.026248156438035 and parameters: {'vizinhos': 20, 'pesos': 'uniform', 'parametro_potencia': 5.81415304141963}. Best is trial 33 with value: 12.021513311287599.\n",
      "[I 2024-11-17 13:07:42,194] Trial 49 finished with value: 12.078820081058211 and parameters: {'vizinhos': 18, 'pesos': 'distance', 'parametro_potencia': 6.964220012860972}. Best is trial 33 with value: 12.021513311287599.\n",
      "[I 2024-11-17 13:07:43,176] Trial 50 finished with value: 12.113461216150458 and parameters: {'vizinhos': 15, 'pesos': 'uniform', 'parametro_potencia': 5.831981178843331}. Best is trial 33 with value: 12.021513311287599.\n",
      "[I 2024-11-17 13:07:44,172] Trial 51 finished with value: 12.064770807738352 and parameters: {'vizinhos': 17, 'pesos': 'uniform', 'parametro_potencia': 6.551380961630473}. Best is trial 33 with value: 12.021513311287599.\n",
      "[I 2024-11-17 13:07:45,136] Trial 52 finished with value: 12.349867199515304 and parameters: {'vizinhos': 9, 'pesos': 'uniform', 'parametro_potencia': 8.764569687831688}. Best is trial 33 with value: 12.021513311287599.\n",
      "[I 2024-11-17 13:07:46,165] Trial 53 finished with value: 12.021976104450566 and parameters: {'vizinhos': 20, 'pesos': 'uniform', 'parametro_potencia': 5.27852535172109}. Best is trial 33 with value: 12.021513311287599.\n",
      "[I 2024-11-17 13:07:47,253] Trial 54 finished with value: 12.022858076689348 and parameters: {'vizinhos': 20, 'pesos': 'uniform', 'parametro_potencia': 5.38453832633127}. Best is trial 33 with value: 12.021513311287599.\n",
      "[I 2024-11-17 13:07:48,313] Trial 55 finished with value: 12.045927927383609 and parameters: {'vizinhos': 19, 'pesos': 'uniform', 'parametro_potencia': 5.34834547478129}. Best is trial 33 with value: 12.021513311287599.\n",
      "[I 2024-11-17 13:07:49,361] Trial 56 finished with value: 12.022178729374952 and parameters: {'vizinhos': 20, 'pesos': 'uniform', 'parametro_potencia': 5.951365924245805}. Best is trial 33 with value: 12.021513311287599.\n",
      "[I 2024-11-17 13:07:50,377] Trial 57 finished with value: 12.019677704294402 and parameters: {'vizinhos': 20, 'pesos': 'uniform', 'parametro_potencia': 4.7865544337983215}. Best is trial 57 with value: 12.019677704294402.\n",
      "[I 2024-11-17 13:07:51,348] Trial 58 finished with value: 12.046455327997768 and parameters: {'vizinhos': 19, 'pesos': 'uniform', 'parametro_potencia': 4.830928502357227}. Best is trial 57 with value: 12.019677704294402.\n",
      "[I 2024-11-17 13:07:52,274] Trial 59 finished with value: 12.867739035825652 and parameters: {'vizinhos': 5, 'pesos': 'uniform', 'parametro_potencia': 4.450074527703204}. Best is trial 57 with value: 12.019677704294402.\n",
      "[I 2024-11-17 13:07:53,358] Trial 60 finished with value: 12.028096437583333 and parameters: {'vizinhos': 20, 'pesos': 'uniform', 'parametro_potencia': 4.033455847836686}. Best is trial 57 with value: 12.019677704294402.\n",
      "[I 2024-11-17 13:07:54,355] Trial 61 finished with value: 12.095263636153897 and parameters: {'vizinhos': 16, 'pesos': 'uniform', 'parametro_potencia': 5.182423263430851}. Best is trial 57 with value: 12.019677704294402.\n",
      "[I 2024-11-17 13:07:55,384] Trial 62 finished with value: 12.059205731672607 and parameters: {'vizinhos': 18, 'pesos': 'uniform', 'parametro_potencia': 5.949374286596144}. Best is trial 57 with value: 12.019677704294402.\n",
      "[I 2024-11-17 13:07:56,361] Trial 63 finished with value: 12.028459101773258 and parameters: {'vizinhos': 20, 'pesos': 'uniform', 'parametro_potencia': 6.536303189684068}. Best is trial 57 with value: 12.019677704294402.\n",
      "[I 2024-11-17 13:07:57,277] Trial 64 finished with value: 12.247396680772987 and parameters: {'vizinhos': 11, 'pesos': 'uniform', 'parametro_potencia': 7.385312974596949}. Best is trial 57 with value: 12.019677704294402.\n",
      "[I 2024-11-17 13:07:58,306] Trial 65 finished with value: 12.02145289762908 and parameters: {'vizinhos': 20, 'pesos': 'uniform', 'parametro_potencia': 4.857737974791718}. Best is trial 57 with value: 12.019677704294402.\n",
      "[I 2024-11-17 13:07:59,325] Trial 66 finished with value: 12.01985666422752 and parameters: {'vizinhos': 20, 'pesos': 'uniform', 'parametro_potencia': 4.789950761837763}. Best is trial 57 with value: 12.019677704294402.\n",
      "[I 2024-11-17 13:08:00,334] Trial 67 finished with value: 12.048326102283827 and parameters: {'vizinhos': 19, 'pesos': 'uniform', 'parametro_potencia': 4.74278360430791}. Best is trial 57 with value: 12.019677704294402.\n",
      "[I 2024-11-17 13:08:01,348] Trial 68 finished with value: 12.0465560144944 and parameters: {'vizinhos': 19, 'pesos': 'uniform', 'parametro_potencia': 4.433258177208786}. Best is trial 57 with value: 12.019677704294402.\n",
      "[I 2024-11-17 13:08:02,365] Trial 69 finished with value: 12.06794721788643 and parameters: {'vizinhos': 19, 'pesos': 'distance', 'parametro_potencia': 4.945577241036726}. Best is trial 57 with value: 12.019677704294402.\n",
      "[I 2024-11-17 13:08:03,363] Trial 70 finished with value: 12.026796127531846 and parameters: {'vizinhos': 20, 'pesos': 'uniform', 'parametro_potencia': 5.5953663162518295}. Best is trial 57 with value: 12.019677704294402.\n",
      "[I 2024-11-17 13:08:04,380] Trial 71 finished with value: 12.060362793582447 and parameters: {'vizinhos': 18, 'pesos': 'uniform', 'parametro_potencia': 5.102262866799245}. Best is trial 57 with value: 12.019677704294402.\n",
      "[I 2024-11-17 13:08:05,368] Trial 72 finished with value: 12.02621937161463 and parameters: {'vizinhos': 20, 'pesos': 'uniform', 'parametro_potencia': 4.307887605773749}. Best is trial 57 with value: 12.019677704294402.\n",
      "[I 2024-11-17 13:08:06,376] Trial 73 finished with value: 12.024394468514034 and parameters: {'vizinhos': 20, 'pesos': 'uniform', 'parametro_potencia': 5.4045574806655825}. Best is trial 57 with value: 12.019677704294402.\n",
      "[I 2024-11-17 13:08:07,350] Trial 74 finished with value: 12.048232323648712 and parameters: {'vizinhos': 19, 'pesos': 'uniform', 'parametro_potencia': 4.673028963247459}. Best is trial 57 with value: 12.019677704294402.\n",
      "[I 2024-11-17 13:08:08,333] Trial 75 finished with value: 12.022013061232093 and parameters: {'vizinhos': 20, 'pesos': 'uniform', 'parametro_potencia': 5.24785876245377}. Best is trial 57 with value: 12.019677704294402.\n",
      "[I 2024-11-17 13:08:09,366] Trial 76 finished with value: 12.022243280073244 and parameters: {'vizinhos': 20, 'pesos': 'uniform', 'parametro_potencia': 4.949858808225305}. Best is trial 57 with value: 12.019677704294402.\n",
      "[I 2024-11-17 13:08:10,417] Trial 77 finished with value: 12.039497947674597 and parameters: {'vizinhos': 19, 'pesos': 'uniform', 'parametro_potencia': 5.6618086212984595}. Best is trial 57 with value: 12.019677704294402.\n",
      "[I 2024-11-17 13:08:11,426] Trial 78 finished with value: 12.169474049380915 and parameters: {'vizinhos': 13, 'pesos': 'uniform', 'parametro_potencia': 6.081629962653141}. Best is trial 57 with value: 12.019677704294402.\n",
      "[I 2024-11-17 13:08:12,403] Trial 79 finished with value: 12.054107701001918 and parameters: {'vizinhos': 18, 'pesos': 'uniform', 'parametro_potencia': 3.892502652330307}. Best is trial 57 with value: 12.019677704294402.\n",
      "[I 2024-11-17 13:08:13,370] Trial 80 finished with value: 12.0921831163812 and parameters: {'vizinhos': 17, 'pesos': 'distance', 'parametro_potencia': 5.1640297509012685}. Best is trial 57 with value: 12.019677704294402.\n",
      "[I 2024-11-17 13:08:14,411] Trial 81 finished with value: 12.027760275512835 and parameters: {'vizinhos': 20, 'pesos': 'uniform', 'parametro_potencia': 4.19308728274039}. Best is trial 57 with value: 12.019677704294402.\n",
      "[I 2024-11-17 13:08:15,387] Trial 82 finished with value: 12.046191938900522 and parameters: {'vizinhos': 19, 'pesos': 'uniform', 'parametro_potencia': 4.517184945002958}. Best is trial 57 with value: 12.019677704294402.\n",
      "[I 2024-11-17 13:08:16,419] Trial 83 finished with value: 12.021962694805067 and parameters: {'vizinhos': 20, 'pesos': 'uniform', 'parametro_potencia': 4.9215259457545635}. Best is trial 57 with value: 12.019677704294402.\n",
      "[I 2024-11-17 13:08:17,401] Trial 84 finished with value: 12.020054605954888 and parameters: {'vizinhos': 20, 'pesos': 'uniform', 'parametro_potencia': 4.781868384559534}. Best is trial 57 with value: 12.019677704294402.\n",
      "[I 2024-11-17 13:08:18,478] Trial 85 finished with value: 12.021074059451944 and parameters: {'vizinhos': 20, 'pesos': 'uniform', 'parametro_potencia': 4.669416980776075}. Best is trial 57 with value: 12.019677704294402.\n",
      "[I 2024-11-17 13:08:19,512] Trial 86 finished with value: 12.047465420797675 and parameters: {'vizinhos': 19, 'pesos': 'uniform', 'parametro_potencia': 4.722295942809045}. Best is trial 57 with value: 12.019677704294402.\n",
      "[I 2024-11-17 13:08:20,511] Trial 87 finished with value: 12.065101410504738 and parameters: {'vizinhos': 18, 'pesos': 'uniform', 'parametro_potencia': 4.952527948464203}. Best is trial 57 with value: 12.019677704294402.\n",
      "[I 2024-11-17 13:08:21,523] Trial 88 finished with value: 12.02641542541075 and parameters: {'vizinhos': 20, 'pesos': 'uniform', 'parametro_potencia': 4.046978250653547}. Best is trial 57 with value: 12.019677704294402.\n",
      "[I 2024-11-17 13:08:22,564] Trial 89 finished with value: 12.042050242742254 and parameters: {'vizinhos': 19, 'pesos': 'uniform', 'parametro_potencia': 3.687423884634624}. Best is trial 57 with value: 12.019677704294402.\n",
      "[I 2024-11-17 13:08:23,571] Trial 90 finished with value: 12.024048240445415 and parameters: {'vizinhos': 20, 'pesos': 'uniform', 'parametro_potencia': 4.520870370044167}. Best is trial 57 with value: 12.019677704294402.\n",
      "[I 2024-11-17 13:08:24,578] Trial 91 finished with value: 12.059664709510933 and parameters: {'vizinhos': 18, 'pesos': 'uniform', 'parametro_potencia': 4.389504831629582}. Best is trial 57 with value: 12.019677704294402.\n",
      "[I 2024-11-17 13:08:25,592] Trial 92 finished with value: 12.067094634090644 and parameters: {'vizinhos': 19, 'pesos': 'distance', 'parametro_potencia': 4.836611321082702}. Best is trial 57 with value: 12.019677704294402.\n",
      "[I 2024-11-17 13:08:26,648] Trial 93 finished with value: 12.022021607912013 and parameters: {'vizinhos': 20, 'pesos': 'uniform', 'parametro_potencia': 5.262684963995002}. Best is trial 57 with value: 12.019677704294402.\n",
      "[I 2024-11-17 13:08:27,625] Trial 94 finished with value: 12.026735938062224 and parameters: {'vizinhos': 20, 'pesos': 'uniform', 'parametro_potencia': 5.579290717399799}. Best is trial 57 with value: 12.019677704294402.\n",
      "[I 2024-11-17 13:08:28,607] Trial 95 finished with value: 12.022393771760417 and parameters: {'vizinhos': 20, 'pesos': 'uniform', 'parametro_potencia': 4.981899495190444}. Best is trial 57 with value: 12.019677704294402.\n",
      "[I 2024-11-17 13:08:29,710] Trial 96 finished with value: 12.047740667880191 and parameters: {'vizinhos': 19, 'pesos': 'uniform', 'parametro_potencia': 4.612553392282175}. Best is trial 57 with value: 12.019677704294402.\n",
