      "[I 2024-11-17 13:08:30,690] Trial 97 finished with value: 12.022063862865531 and parameters: {'vizinhos': 20, 'pesos': 'uniform', 'parametro_potencia': 5.29817062772243}. Best is trial 57 with value: 12.019677704294402.\n",
      "[I 2024-11-17 13:08:31,822] Trial 98 finished with value: 12.041918075301309 and parameters: {'vizinhos': 19, 'pesos': 'uniform', 'parametro_potencia': 5.525142918371208}. Best is trial 57 with value: 12.019677704294402.\n",
      "[I 2024-11-17 13:08:32,812] Trial 99 finished with value: 12.028469305966473 and parameters: {'vizinhos': 20, 'pesos': 'uniform', 'parametro_potencia': 4.170858163692881}. Best is trial 57 with value: 12.019677704294402.\n",
      "[I 2024-11-17 13:08:33,806] Trial 100 finished with value: 12.025927300823192 and parameters: {'vizinhos': 20, 'pesos': 'uniform', 'parametro_potencia': 5.808276105696772}. Best is trial 57 with value: 12.019677704294402.\n",
      "[I 2024-11-17 13:08:34,820] Trial 101 finished with value: 12.047102031315914 and parameters: {'vizinhos': 19, 'pesos': 'uniform', 'parametro_potencia': 4.820969186743893}. Best is trial 57 with value: 12.019677704294402.\n",
      "[I 2024-11-17 13:08:35,840] Trial 102 finished with value: 12.061021649825882 and parameters: {'vizinhos': 18, 'pesos': 'uniform', 'parametro_potencia': 5.117795149626403}. Best is trial 57 with value: 12.019677704294402.\n",
      "[I 2024-11-17 13:08:36,886] Trial 103 finished with value: 12.021840516002541 and parameters: {'vizinhos': 20, 'pesos': 'uniform', 'parametro_potencia': 5.259451221728884}. Best is trial 57 with value: 12.019677704294402.\n",
      "[I 2024-11-17 13:08:37,870] Trial 104 finished with value: 12.021296302210668 and parameters: {'vizinhos': 20, 'pesos': 'uniform', 'parametro_potencia': 4.673285461105137}. Best is trial 57 with value: 12.019677704294402.\n",
      "[I 2024-11-17 13:08:38,944] Trial 105 finished with value: 12.046826039218171 and parameters: {'vizinhos': 19, 'pesos': 'uniform', 'parametro_potencia': 4.721017675986225}. Best is trial 57 with value: 12.019677704294402.\n",
      "[I 2024-11-17 13:08:39,968] Trial 106 finished with value: 12.02483425258741 and parameters: {'vizinhos': 20, 'pesos': 'uniform', 'parametro_potencia': 5.03976280650929}. Best is trial 57 with value: 12.019677704294402.\n",
      "[I 2024-11-17 13:08:40,983] Trial 107 finished with value: 12.025276214102801 and parameters: {'vizinhos': 20, 'pesos': 'uniform', 'parametro_potencia': 4.331337576056899}. Best is trial 57 with value: 12.019677704294402.\n",
      "[I 2024-11-17 13:08:42,023] Trial 108 finished with value: 12.047692580809144 and parameters: {'vizinhos': 19, 'pesos': 'uniform', 'parametro_potencia': 4.574655203465032}. Best is trial 57 with value: 12.019677704294402.\n",
      "[I 2024-11-17 13:08:43,006] Trial 109 finished with value: 12.021786551753891 and parameters: {'vizinhos': 20, 'pesos': 'uniform', 'parametro_potencia': 4.849374819595932}. Best is trial 57 with value: 12.019677704294402.\n",
      "[I 2024-11-17 13:08:43,997] Trial 110 finished with value: 12.048194549409413 and parameters: {'vizinhos': 19, 'pesos': 'uniform', 'parametro_potencia': 4.934984543674195}. Best is trial 57 with value: 12.019677704294402.\n",
      "[I 2024-11-17 13:08:45,019] Trial 111 finished with value: 12.030678782301893 and parameters: {'vizinhos': 20, 'pesos': 'uniform', 'parametro_potencia': 3.9246281732522865}. Best is trial 57 with value: 12.019677704294402.\n",
      "[I 2024-11-17 13:08:46,020] Trial 112 finished with value: 12.041582094098224 and parameters: {'vizinhos': 20, 'pesos': 'distance', 'parametro_potencia': 4.6479867722308335}. Best is trial 57 with value: 12.019677704294402.\n",
      "[I 2024-11-17 13:08:47,042] Trial 113 finished with value: 12.021800119594923 and parameters: {'vizinhos': 20, 'pesos': 'uniform', 'parametro_potencia': 4.843108095469665}. Best is trial 57 with value: 12.019677704294402.\n",
      "[I 2024-11-17 13:08:48,027] Trial 114 finished with value: 12.021634675572749 and parameters: {'vizinhos': 20, 'pesos': 'uniform', 'parametro_potencia': 4.839049126569925}. Best is trial 57 with value: 12.019677704294402.\n",
      "[I 2024-11-17 13:08:49,048] Trial 115 finished with value: 12.043341978637564 and parameters: {'vizinhos': 19, 'pesos': 'uniform', 'parametro_potencia': 4.24408838862954}. Best is trial 57 with value: 12.019677704294402.\n",
      "[I 2024-11-17 13:08:50,059] Trial 116 finished with value: 12.024346088738561 and parameters: {'vizinhos': 20, 'pesos': 'uniform', 'parametro_potencia': 4.441712280797475}. Best is trial 57 with value: 12.019677704294402.\n",
      "[I 2024-11-17 13:08:51,153] Trial 117 finished with value: 12.035321246271518 and parameters: {'vizinhos': 20, 'pesos': 'uniform', 'parametro_potencia': 2.4683752786509423}. Best is trial 57 with value: 12.019677704294402.\n",
      "[I 2024-11-17 13:08:52,180] Trial 118 finished with value: 12.047879817596947 and parameters: {'vizinhos': 19, 'pesos': 'uniform', 'parametro_potencia': 4.8418083349076735}. Best is trial 57 with value: 12.019677704294402.\n",
      "[I 2024-11-17 13:08:53,159] Trial 119 finished with value: 12.045067901933702 and parameters: {'vizinhos': 19, 'pesos': 'uniform', 'parametro_potencia': 5.096915074120746}. Best is trial 57 with value: 12.019677704294402.\n",
      "[I 2024-11-17 13:08:54,204] Trial 120 finished with value: 12.024990859804369 and parameters: {'vizinhos': 20, 'pesos': 'uniform', 'parametro_potencia': 5.417018333470556}. Best is trial 57 with value: 12.019677704294402.\n",
      "[I 2024-11-17 13:08:55,154] Trial 121 finished with value: 12.146570387553641 and parameters: {'vizinhos': 14, 'pesos': 'uniform', 'parametro_potencia': 4.626325574288736}. Best is trial 57 with value: 12.019677704294402.\n",
      "[I 2024-11-17 13:08:56,162] Trial 122 finished with value: 12.063170811063806 and parameters: {'vizinhos': 18, 'pesos': 'uniform', 'parametro_potencia': 4.757429370098553}. Best is trial 57 with value: 12.019677704294402.\n",
      "[I 2024-11-17 13:08:57,268] Trial 123 finished with value: 12.020279769749715 and parameters: {'vizinhos': 20, 'pesos': 'uniform', 'parametro_potencia': 4.8930025599427065}. Best is trial 57 with value: 12.019677704294402.\n",
      "[I 2024-11-17 13:08:58,312] Trial 124 finished with value: 12.023762822728582 and parameters: {'vizinhos': 20, 'pesos': 'uniform', 'parametro_potencia': 4.411732022423723}. Best is trial 57 with value: 12.019677704294402.\n",
      "[I 2024-11-17 13:08:59,336] Trial 125 finished with value: 12.022657872799812 and parameters: {'vizinhos': 20, 'pesos': 'uniform', 'parametro_potencia': 5.234108902033761}. Best is trial 57 with value: 12.019677704294402.\n",
      "[I 2024-11-17 13:09:00,341] Trial 126 finished with value: 12.047229814211324 and parameters: {'vizinhos': 19, 'pesos': 'uniform', 'parametro_potencia': 5.064291434985206}. Best is trial 57 with value: 12.019677704294402.\n",
      "[I 2024-11-17 13:09:01,371] Trial 127 finished with value: 12.021935989645467 and parameters: {'vizinhos': 20, 'pesos': 'uniform', 'parametro_potencia': 4.533540403554103}. Best is trial 57 with value: 12.019677704294402.\n",
      "[I 2024-11-17 13:09:02,233] Trial 128 finished with value: 12.675521812339364 and parameters: {'vizinhos': 6, 'pesos': 'uniform', 'parametro_potencia': 5.644974641187082}. Best is trial 57 with value: 12.019677704294402.\n",
      "[I 2024-11-17 13:09:03,238] Trial 129 finished with value: 12.048351407110482 and parameters: {'vizinhos': 19, 'pesos': 'uniform', 'parametro_potencia': 4.7656495526546285}. Best is trial 57 with value: 12.019677704294402.\n",
      "[I 2024-11-17 13:09:04,204] Trial 130 finished with value: 12.297112936766473 and parameters: {'vizinhos': 10, 'pesos': 'uniform', 'parametro_potencia': 5.057513334296117}. Best is trial 57 with value: 12.019677704294402.\n",
      "[I 2024-11-17 13:09:05,210] Trial 131 finished with value: 12.041476040655514 and parameters: {'vizinhos': 20, 'pesos': 'distance', 'parametro_potencia': 5.357603885325154}. Best is trial 57 with value: 12.019677704294402.\n",
      "[I 2024-11-17 13:09:06,225] Trial 132 finished with value: 12.049164063783193 and parameters: {'vizinhos': 19, 'pesos': 'uniform', 'parametro_potencia': 4.898181270648436}. Best is trial 57 with value: 12.019677704294402.\n",
      "[I 2024-11-17 13:09:07,239] Trial 133 finished with value: 12.022444522156938 and parameters: {'vizinhos': 20, 'pesos': 'uniform', 'parametro_potencia': 4.545390432958551}. Best is trial 57 with value: 12.019677704294402.\n",
      "[I 2024-11-17 13:09:08,252] Trial 134 finished with value: 12.026192229543256 and parameters: {'vizinhos': 20, 'pesos': 'uniform', 'parametro_potencia': 4.287066890020118}. Best is trial 57 with value: 12.019677704294402.\n",
      "[I 2024-11-17 13:09:09,379] Trial 135 finished with value: 12.025739566397329 and parameters: {'vizinhos': 20, 'pesos': 'uniform', 'parametro_potencia': 4.086213918825697}. Best is trial 57 with value: 12.019677704294402.\n",
      "[I 2024-11-17 13:09:10,427] Trial 136 finished with value: 12.026109812968134 and parameters: {'vizinhos': 20, 'pesos': 'uniform', 'parametro_potencia': 4.475197749110508}. Best is trial 57 with value: 12.019677704294402.\n",
      "[I 2024-11-17 13:09:11,426] Trial 137 finished with value: 12.01797041451045 and parameters: {'vizinhos': 20, 'pesos': 'uniform', 'parametro_potencia': 4.7062239146607645}. Best is trial 137 with value: 12.01797041451045.\n",
      "[I 2024-11-17 13:09:12,480] Trial 138 finished with value: 12.04737880682827 and parameters: {'vizinhos': 19, 'pesos': 'uniform', 'parametro_potencia': 4.681966512636213}. Best is trial 137 with value: 12.01797041451045.\n",
      "[I 2024-11-17 13:09:13,462] Trial 139 finished with value: 12.023708340300237 and parameters: {'vizinhos': 20, 'pesos': 'uniform', 'parametro_potencia': 5.209009888544512}. Best is trial 137 with value: 12.01797041451045.\n",
      "[I 2024-11-17 13:09:14,462] Trial 140 finished with value: 12.027191430451499 and parameters: {'vizinhos': 20, 'pesos': 'uniform', 'parametro_potencia': 5.495026460556141}. Best is trial 137 with value: 12.01797041451045.\n",
      "[I 2024-11-17 13:09:15,467] Trial 141 finished with value: 12.048385844946553 and parameters: {'vizinhos': 19, 'pesos': 'uniform', 'parametro_potencia': 4.901773736948356}. Best is trial 137 with value: 12.01797041451045.\n",
      "[I 2024-11-17 13:09:16,469] Trial 142 finished with value: 12.026718521297273 and parameters: {'vizinhos': 20, 'pesos': 'uniform', 'parametro_potencia': 5.7468072011724365}. Best is trial 137 with value: 12.01797041451045.\n",
      "[I 2024-11-17 13:09:17,519] Trial 143 finished with value: 12.018884382121945 and parameters: {'vizinhos': 20, 'pesos': 'uniform', 'parametro_potencia': 4.720229864732436}. Best is trial 137 with value: 12.01797041451045.\n",
      "[I 2024-11-17 13:09:18,505] Trial 144 finished with value: 12.020047418683413 and parameters: {'vizinhos': 20, 'pesos': 'uniform', 'parametro_potencia': 4.760037002481512}. Best is trial 137 with value: 12.01797041451045.\n",
      "[I 2024-11-17 13:09:19,607] Trial 145 finished with value: 12.01811955631954 and parameters: {'vizinhos': 20, 'pesos': 'uniform', 'parametro_potencia': 4.709673300002715}. Best is trial 137 with value: 12.01797041451045.\n",
      "[I 2024-11-17 13:09:20,615] Trial 146 finished with value: 12.020144151682107 and parameters: {'vizinhos': 20, 'pesos': 'uniform', 'parametro_potencia': 4.694586136271953}. Best is trial 137 with value: 12.01797041451045.\n",
      "[I 2024-11-17 13:09:21,676] Trial 147 finished with value: 12.047393161753249 and parameters: {'vizinhos': 19, 'pesos': 'uniform', 'parametro_potencia': 4.681131045814397}. Best is trial 137 with value: 12.01797041451045.\n",
      "[I 2024-11-17 13:09:22,668] Trial 148 finished with value: 12.023053187552593 and parameters: {'vizinhos': 20, 'pesos': 'uniform', 'parametro_potencia': 4.385477998171828}. Best is trial 137 with value: 12.01797041451045.\n",
      "[I 2024-11-17 13:09:23,665] Trial 149 finished with value: 12.042164105559507 and parameters: {'vizinhos': 19, 'pesos': 'uniform', 'parametro_potencia': 4.175777450563798}. Best is trial 137 with value: 12.01797041451045.\n",
      "[I 2024-11-17 13:09:24,719] Trial 150 finished with value: 12.021253663824087 and parameters: {'vizinhos': 20, 'pesos': 'uniform', 'parametro_potencia': 4.6867902170731925}. Best is trial 137 with value: 12.01797041451045.\n",
      "[I 2024-11-17 13:09:25,820] Trial 151 finished with value: 12.019785120320105 and parameters: {'vizinhos': 20, 'pesos': 'uniform', 'parametro_potencia': 4.6003352255239705}. Best is trial 137 with value: 12.01797041451045.\n",
      "[I 2024-11-17 13:09:26,914] Trial 152 finished with value: 12.047828503399785 and parameters: {'vizinhos': 19, 'pesos': 'uniform', 'parametro_potencia': 4.592913449619355}. Best is trial 137 with value: 12.01797041451045.\n",
      "[I 2024-11-17 13:09:27,977] Trial 153 finished with value: 12.024353757786061 and parameters: {'vizinhos': 20, 'pesos': 'uniform', 'parametro_potencia': 4.375095927339183}. Best is trial 137 with value: 12.01797041451045.\n",
      "[I 2024-11-17 13:09:28,966] Trial 154 finished with value: 12.017846492951351 and parameters: {'vizinhos': 20, 'pesos': 'uniform', 'parametro_potencia': 4.703707932078681}. Best is trial 154 with value: 12.017846492951351.\n",
      "[I 2024-11-17 13:09:30,095] Trial 155 finished with value: 12.021074059451944 and parameters: {'vizinhos': 20, 'pesos': 'uniform', 'parametro_potencia': 4.669289960923556}. Best is trial 154 with value: 12.017846492951351.\n",
      "[I 2024-11-17 13:09:31,105] Trial 156 finished with value: 12.021309506938493 and parameters: {'vizinhos': 20, 'pesos': 'uniform', 'parametro_potencia': 4.689618234258707}. Best is trial 154 with value: 12.017846492951351.\n",
      "[I 2024-11-17 13:09:32,216] Trial 157 finished with value: 12.025273256267072 and parameters: {'vizinhos': 20, 'pesos': 'uniform', 'parametro_potencia': 4.495205347129398}. Best is trial 154 with value: 12.017846492951351.\n",
      "[I 2024-11-17 13:09:33,249] Trial 158 finished with value: 12.199704378982467 and parameters: {'vizinhos': 12, 'pesos': 'uniform', 'parametro_potencia': 4.66762439917222}. Best is trial 154 with value: 12.017846492951351.\n",
      "[I 2024-11-17 13:09:34,252] Trial 159 finished with value: 12.043510401165404 and parameters: {'vizinhos': 19, 'pesos': 'uniform', 'parametro_potencia': 4.241478323319028}. Best is trial 154 with value: 12.017846492951351.\n",
      "[I 2024-11-17 13:09:35,388] Trial 160 finished with value: 12.018020249067728 and parameters: {'vizinhos': 20, 'pesos': 'uniform', 'parametro_potencia': 4.711847352948879}. Best is trial 154 with value: 12.017846492951351.\n",
      "[I 2024-11-17 13:09:36,409] Trial 161 finished with value: 12.044144459856318 and parameters: {'vizinhos': 20, 'pesos': 'distance', 'parametro_potencia': 5.037459935614693}. Best is trial 154 with value: 12.017846492951351.\n",
      "[I 2024-11-17 13:09:37,458] Trial 162 finished with value: 12.044826841331735 and parameters: {'vizinhos': 19, 'pesos': 'uniform', 'parametro_potencia': 4.3333440046014875}. Best is trial 154 with value: 12.017846492951351.\n",
      "[I 2024-11-17 13:09:38,501] Trial 163 finished with value: 12.017840714433753 and parameters: {'vizinhos': 20, 'pesos': 'uniform', 'parametro_potencia': 4.707739692974665}. Best is trial 163 with value: 12.017840714433753.\n",
      "[I 2024-11-17 13:09:39,493] Trial 164 finished with value: 12.020339250155917 and parameters: {'vizinhos': 20, 'pesos': 'uniform', 'parametro_potencia': 4.609698019957472}. Best is trial 163 with value: 12.017840714433753.\n",
      "[I 2024-11-17 13:09:40,533] Trial 165 finished with value: 12.023215837922137 and parameters: {'vizinhos': 20, 'pesos': 'uniform', 'parametro_potencia': 4.400903726933054}. Best is trial 163 with value: 12.017840714433753.\n",
      "[I 2024-11-17 13:09:41,555] Trial 166 finished with value: 12.022313806263133 and parameters: {'vizinhos': 20, 'pesos': 'uniform', 'parametro_potencia': 4.549318642784469}. Best is trial 163 with value: 12.017840714433753.\n",
      "[I 2024-11-17 13:09:42,589] Trial 167 finished with value: 12.021399649307822 and parameters: {'vizinhos': 20, 'pesos': 'uniform', 'parametro_potencia': 4.993773217587544}. Best is trial 163 with value: 12.017840714433753.\n",
      "[I 2024-11-17 13:09:43,648] Trial 168 finished with value: 12.046643649260433 and parameters: {'vizinhos': 19, 'pesos': 'uniform', 'parametro_potencia': 4.513861773154403}. Best is trial 163 with value: 12.017840714433753.\n",
      "[I 2024-11-17 13:09:44,677] Trial 169 finished with value: 12.046509575741862 and parameters: {'vizinhos': 19, 'pesos': 'uniform', 'parametro_potencia': 4.8063690573560605}. Best is trial 163 with value: 12.017840714433753.\n",
      "[I 2024-11-17 13:09:45,702] Trial 170 finished with value: 12.01968710041678 and parameters: {'vizinhos': 20, 'pesos': 'uniform', 'parametro_potencia': 4.739357558168596}. Best is trial 163 with value: 12.017840714433753.\n",
      "[I 2024-11-17 13:09:46,701] Trial 171 finished with value: 12.0262034663745 and parameters: {'vizinhos': 20, 'pesos': 'uniform', 'parametro_potencia': 4.079758176563254}. Best is trial 163 with value: 12.017840714433753.\n",
      "[I 2024-11-17 13:09:47,772] Trial 172 finished with value: 12.021596256435476 and parameters: {'vizinhos': 20, 'pesos': 'uniform', 'parametro_potencia': 4.938333524424137}. Best is trial 163 with value: 12.017840714433753.\n",
      "[I 2024-11-17 13:09:48,782] Trial 173 finished with value: 12.019478564543281 and parameters: {'vizinhos': 20, 'pesos': 'uniform', 'parametro_potencia': 4.75374276387824}. Best is trial 163 with value: 12.017840714433753.\n",
      "[I 2024-11-17 13:09:49,805] Trial 174 finished with value: 12.020075917557422 and parameters: {'vizinhos': 20, 'pesos': 'uniform', 'parametro_potencia': 4.761938641984732}. Best is trial 163 with value: 12.017840714433753.\n",
      "[I 2024-11-17 13:09:50,817] Trial 175 finished with value: 12.019650720627743 and parameters: {'vizinhos': 20, 'pesos': 'uniform', 'parametro_potencia': 4.790262311639891}. Best is trial 163 with value: 12.017840714433753.\n",
      "[I 2024-11-17 13:09:51,862] Trial 176 finished with value: 12.02454254829248 and parameters: {'vizinhos': 20, 'pesos': 'uniform', 'parametro_potencia': 5.05020030220745}. Best is trial 163 with value: 12.017840714433753.\n",
      "[I 2024-11-17 13:09:52,869] Trial 177 finished with value: 12.019866019828367 and parameters: {'vizinhos': 20, 'pesos': 'uniform', 'parametro_potencia': 4.7850192497642485}. Best is trial 163 with value: 12.017840714433753.\n",
      "[I 2024-11-17 13:09:53,957] Trial 178 finished with value: 12.045677022677507 and parameters: {'vizinhos': 19, 'pesos': 'uniform', 'parametro_potencia': 4.81423929622631}. Best is trial 163 with value: 12.017840714433753.\n",
      "[I 2024-11-17 13:09:55,006] Trial 179 finished with value: 12.024755182599073 and parameters: {'vizinhos': 20, 'pesos': 'uniform', 'parametro_potencia': 5.1440691901948545}. Best is trial 163 with value: 12.017840714433753.\n",
      "[I 2024-11-17 13:09:56,013] Trial 180 finished with value: 12.047845182550855 and parameters: {'vizinhos': 19, 'pesos': 'uniform', 'parametro_potencia': 4.952132986809102}. Best is trial 163 with value: 12.017840714433753.\n",
      "[I 2024-11-17 13:09:57,066] Trial 181 finished with value: 12.019645164743247 and parameters: {'vizinhos': 20, 'pesos': 'uniform', 'parametro_potencia': 4.7937646420811495}. Best is trial 163 with value: 12.017840714433753.\n",
      "[I 2024-11-17 13:09:58,259] Trial 182 finished with value: 12.024196266163797 and parameters: {'vizinhos': 20, 'pesos': 'uniform', 'parametro_potencia': 4.511833950448541}. Best is trial 163 with value: 12.017840714433753.\n",
      "[I 2024-11-17 13:09:59,298] Trial 183 finished with value: 12.021159776921227 and parameters: {'vizinhos': 20, 'pesos': 'uniform', 'parametro_potencia': 4.7973993278737}. Best is trial 163 with value: 12.017840714433753.\n",
      "[I 2024-11-17 13:10:00,308] Trial 184 finished with value: 12.021559925451488 and parameters: {'vizinhos': 20, 'pesos': 'uniform', 'parametro_potencia': 4.837702820875955}. Best is trial 163 with value: 12.017840714433753.\n",
      "[I 2024-11-17 13:10:01,419] Trial 185 finished with value: 12.023224470597912 and parameters: {'vizinhos': 20, 'pesos': 'uniform', 'parametro_potencia': 5.015595686366276}. Best is trial 163 with value: 12.017840714433753.\n",
      "[I 2024-11-17 13:10:02,451] Trial 186 finished with value: 12.046253634687403 and parameters: {'vizinhos': 19, 'pesos': 'uniform', 'parametro_potencia': 4.504720856217248}. Best is trial 163 with value: 12.017840714433753.\n",
      "[I 2024-11-17 13:10:03,511] Trial 187 finished with value: 12.019888594087874 and parameters: {'vizinhos': 20, 'pesos': 'uniform', 'parametro_potencia': 4.7363029577889}. Best is trial 163 with value: 12.017840714433753.\n",
      "[I 2024-11-17 13:10:04,502] Trial 188 finished with value: 12.01987709458441 and parameters: {'vizinhos': 20, 'pesos': 'uniform', 'parametro_potencia': 4.737210593061582}. Best is trial 163 with value: 12.017840714433753.\n",
      "[I 2024-11-17 13:10:05,528] Trial 189 finished with value: 12.023601892488836 and parameters: {'vizinhos': 20, 'pesos': 'uniform', 'parametro_potencia': 4.368016459981154}. Best is trial 163 with value: 12.017840714433753.\n",
      "[I 2024-11-17 13:10:06,535] Trial 190 finished with value: 12.047864194869238 and parameters: {'vizinhos': 19, 'pesos': 'uniform', 'parametro_potencia': 4.730894760502676}. Best is trial 163 with value: 12.017840714433753.\n",
