      "[I 2024-11-17 12:45:53,643] Trial 275 finished with value: 11.943012234318939 and parameters: {'num_arvores': 455, 'critério': 'poisson', 'min_exemplos_split': 44, 'min_exemplos_folha': 9, 'num_max_atributos': 0.3332356104703427}. Best is trial 52 with value: 11.930406468948263.\n",
      "[I 2024-11-17 12:46:04,642] Trial 276 finished with value: 11.940585557268564 and parameters: {'num_arvores': 468, 'critério': 'poisson', 'min_exemplos_split': 35, 'min_exemplos_folha': 11, 'num_max_atributos': 0.35704965006357964}. Best is trial 52 with value: 11.930406468948263.\n",
      "[I 2024-11-17 12:46:15,589] Trial 277 finished with value: 11.932805311306463 and parameters: {'num_arvores': 478, 'critério': 'poisson', 'min_exemplos_split': 40, 'min_exemplos_folha': 10, 'num_max_atributos': 0.40493836794031957}. Best is trial 52 with value: 11.930406468948263.\n",
      "[I 2024-11-17 12:46:27,902] Trial 278 finished with value: 11.940096870804163 and parameters: {'num_arvores': 450, 'critério': 'poisson', 'min_exemplos_split': 14, 'min_exemplos_folha': 10, 'num_max_atributos': 0.40425462465256956}. Best is trial 52 with value: 11.930406468948263.\n",
      "[I 2024-11-17 12:46:38,861] Trial 279 finished with value: 11.938095140615442 and parameters: {'num_arvores': 473, 'critério': 'squared_error', 'min_exemplos_split': 38, 'min_exemplos_folha': 8, 'num_max_atributos': 0.39103779046364084}. Best is trial 52 with value: 11.930406468948263.\n",
      "[I 2024-11-17 12:46:49,712] Trial 280 finished with value: 11.938251161177927 and parameters: {'num_arvores': 460, 'critério': 'poisson', 'min_exemplos_split': 32, 'min_exemplos_folha': 12, 'num_max_atributos': 0.4120742610879845}. Best is trial 52 with value: 11.930406468948263.\n",
      "[I 2024-11-17 12:47:01,027] Trial 281 finished with value: 11.937590544313798 and parameters: {'num_arvores': 479, 'critério': 'poisson', 'min_exemplos_split': 40, 'min_exemplos_folha': 6, 'num_max_atributos': 0.3557960748619759}. Best is trial 52 with value: 11.930406468948263.\n",
      "[I 2024-11-17 12:47:11,980] Trial 282 finished with value: 11.938556354315814 and parameters: {'num_arvores': 467, 'critério': 'poisson', 'min_exemplos_split': 36, 'min_exemplos_folha': 10, 'num_max_atributos': 0.3819425497428676}. Best is trial 52 with value: 11.930406468948263.\n",
      "[I 2024-11-17 12:47:23,813] Trial 283 finished with value: 11.937267610978042 and parameters: {'num_arvores': 445, 'critério': 'poisson', 'min_exemplos_split': 45, 'min_exemplos_folha': 7, 'num_max_atributos': 0.4259828765066209}. Best is trial 52 with value: 11.930406468948263.\n",
      "[I 2024-11-17 12:47:34,670] Trial 284 finished with value: 11.934767151762449 and parameters: {'num_arvores': 460, 'critério': 'poisson', 'min_exemplos_split': 42, 'min_exemplos_folha': 11, 'num_max_atributos': 0.4020889890319025}. Best is trial 52 with value: 11.930406468948263.\n",
      "[I 2024-11-17 12:47:42,631] Trial 285 finished with value: 11.928484765389639 and parameters: {'num_arvores': 328, 'critério': 'poisson', 'min_exemplos_split': 33, 'min_exemplos_folha': 10, 'num_max_atributos': 0.373378161075968}. Best is trial 285 with value: 11.928484765389639.\n",
      "[I 2024-11-17 12:47:50,910] Trial 286 finished with value: 11.929063457887949 and parameters: {'num_arvores': 336, 'critério': 'poisson', 'min_exemplos_split': 33, 'min_exemplos_folha': 10, 'num_max_atributos': 0.43061923917846323}. Best is trial 285 with value: 11.928484765389639.\n",
      "[I 2024-11-17 12:47:59,095] Trial 287 finished with value: 11.933441369732263 and parameters: {'num_arvores': 326, 'critério': 'poisson', 'min_exemplos_split': 32, 'min_exemplos_folha': 10, 'num_max_atributos': 0.3628080195045297}. Best is trial 285 with value: 11.928484765389639.\n",
      "[I 2024-11-17 12:48:07,586] Trial 288 finished with value: 11.942239855214796 and parameters: {'num_arvores': 341, 'critério': 'poisson', 'min_exemplos_split': 34, 'min_exemplos_folha': 11, 'num_max_atributos': 0.41114784358282824}. Best is trial 285 with value: 11.928484765389639.\n",
      "[I 2024-11-17 12:48:15,251] Trial 289 finished with value: 11.93934637820864 and parameters: {'num_arvores': 290, 'critério': 'poisson', 'min_exemplos_split': 33, 'min_exemplos_folha': 13, 'num_max_atributos': 0.34190868130201096}. Best is trial 285 with value: 11.928484765389639.\n",
      "[I 2024-11-17 12:48:26,644] Trial 290 finished with value: 11.938235995622792 and parameters: {'num_arvores': 438, 'critério': 'poisson', 'min_exemplos_split': 35, 'min_exemplos_folha': 12, 'num_max_atributos': 0.4309942195840033}. Best is trial 285 with value: 11.928484765389639.\n",
      "[I 2024-11-17 12:48:35,850] Trial 291 finished with value: 11.938061631504702 and parameters: {'num_arvores': 365, 'critério': 'poisson', 'min_exemplos_split': 47, 'min_exemplos_folha': 10, 'num_max_atributos': 0.45627895882884056}. Best is trial 285 with value: 11.928484765389639.\n",
      "[I 2024-11-17 12:48:47,081] Trial 292 finished with value: 11.934103084532643 and parameters: {'num_arvores': 479, 'critério': 'poisson', 'min_exemplos_split': 41, 'min_exemplos_folha': 9, 'num_max_atributos': 0.39520995950684396}. Best is trial 285 with value: 11.928484765389639.\n",
      "[I 2024-11-17 12:48:54,564] Trial 293 finished with value: 11.941835503077334 and parameters: {'num_arvores': 307, 'critério': 'poisson', 'min_exemplos_split': 37, 'min_exemplos_folha': 7, 'num_max_atributos': 0.3710060393794045}. Best is trial 285 with value: 11.928484765389639.\n",
      "[I 2024-11-17 12:49:03,186] Trial 294 finished with value: 11.940635474167443 and parameters: {'num_arvores': 351, 'critério': 'poisson', 'min_exemplos_split': 44, 'min_exemplos_folha': 11, 'num_max_atributos': 0.4186639758264896}. Best is trial 285 with value: 11.928484765389639.\n",
      "[I 2024-11-17 12:49:15,142] Trial 295 finished with value: 11.931939283022535 and parameters: {'num_arvores': 452, 'critério': 'poisson', 'min_exemplos_split': 40, 'min_exemplos_folha': 8, 'num_max_atributos': 0.4920607491488995}. Best is trial 285 with value: 11.928484765389639.\n",
      "[I 2024-11-17 12:49:23,614] Trial 296 finished with value: 11.972337634790811 and parameters: {'num_arvores': 318, 'critério': 'poisson', 'min_exemplos_split': 40, 'min_exemplos_folha': 8, 'num_max_atributos': 0.5056918435336779}. Best is trial 285 with value: 11.928484765389639.\n",
      "[I 2024-11-17 12:49:30,604] Trial 297 finished with value: 11.958294714657633 and parameters: {'num_arvores': 253, 'critério': 'poisson', 'min_exemplos_split': 49, 'min_exemplos_folha': 10, 'num_max_atributos': 0.521734279917786}. Best is trial 285 with value: 11.928484765389639.\n",
      "[I 2024-11-17 12:49:42,053] Trial 298 finished with value: 11.94555765255514 and parameters: {'num_arvores': 448, 'critério': 'poisson', 'min_exemplos_split': 43, 'min_exemplos_folha': 13, 'num_max_atributos': 0.4906378534833031}. Best is trial 285 with value: 11.928484765389639.\n",
      "[I 2024-11-17 12:49:48,173] Trial 299 finished with value: 11.943177567143799 and parameters: {'num_arvores': 235, 'critério': 'poisson', 'min_exemplos_split': 39, 'min_exemplos_folha': 8, 'num_max_atributos': 0.45714111677047153}. Best is trial 285 with value: 11.928484765389639.\n",
      "[I 2024-11-17 12:49:55,841] Trial 300 finished with value: 11.937831446830957 and parameters: {'num_arvores': 291, 'critério': 'poisson', 'min_exemplos_split': 44, 'min_exemplos_folha': 7, 'num_max_atributos': 0.4342426202143939}. Best is trial 285 with value: 11.928484765389639.\n",
      "[I 2024-11-17 12:50:07,682] Trial 301 finished with value: 11.935980208330832 and parameters: {'num_arvores': 454, 'critério': 'poisson', 'min_exemplos_split': 41, 'min_exemplos_folha': 12, 'num_max_atributos': 0.4505200031229173}. Best is trial 285 with value: 11.928484765389639.\n",
      "[I 2024-11-17 12:50:18,757] Trial 302 finished with value: 11.941147441620977 and parameters: {'num_arvores': 432, 'critério': 'squared_error', 'min_exemplos_split': 35, 'min_exemplos_folha': 10, 'num_max_atributos': 0.4771513483388699}. Best is trial 285 with value: 11.928484765389639.\n",
      "[I 2024-11-17 12:50:30,066] Trial 303 finished with value: 11.935444021608765 and parameters: {'num_arvores': 479, 'critério': 'poisson', 'min_exemplos_split': 46, 'min_exemplos_folha': 8, 'num_max_atributos': 0.394145999500348}. Best is trial 285 with value: 11.928484765389639.\n",
      "[I 2024-11-17 12:50:42,104] Trial 304 finished with value: 11.934910545161594 and parameters: {'num_arvores': 453, 'critério': 'poisson', 'min_exemplos_split': 38, 'min_exemplos_folha': 9, 'num_max_atributos': 0.4830802812606958}. Best is trial 285 with value: 11.928484765389639.\n",
      "[I 2024-11-17 12:50:51,636] Trial 305 finished with value: 11.93430820482733 and parameters: {'num_arvores': 374, 'critério': 'poisson', 'min_exemplos_split': 33, 'min_exemplos_folha': 9, 'num_max_atributos': 0.42701880328135045}. Best is trial 285 with value: 11.928484765389639.\n",
      "[I 2024-11-17 12:51:02,619] Trial 306 finished with value: 11.935052501421001 and parameters: {'num_arvores': 470, 'critério': 'poisson', 'min_exemplos_split': 42, 'min_exemplos_folha': 11, 'num_max_atributos': 0.37979038379399915}. Best is trial 285 with value: 11.928484765389639.\n",
      "[I 2024-11-17 12:51:09,547] Trial 307 finished with value: 11.937873218400263 and parameters: {'num_arvores': 271, 'critério': 'friedman_mse', 'min_exemplos_split': 40, 'min_exemplos_folha': 7, 'num_max_atributos': 0.4130379841467067}. Best is trial 285 with value: 11.928484765389639.\n",
      "[I 2024-11-17 12:51:17,716] Trial 308 finished with value: 11.931350325675938 and parameters: {'num_arvores': 332, 'critério': 'poisson', 'min_exemplos_split': 36, 'min_exemplos_folha': 8, 'num_max_atributos': 0.4518349272160858}. Best is trial 285 with value: 11.928484765389639.\n",
      "[I 2024-11-17 12:51:25,883] Trial 309 finished with value: 11.945193020507391 and parameters: {'num_arvores': 322, 'critério': 'poisson', 'min_exemplos_split': 31, 'min_exemplos_folha': 6, 'num_max_atributos': 0.4565115172821246}. Best is trial 285 with value: 11.928484765389639.\n",
      "[I 2024-11-17 12:51:33,849] Trial 310 finished with value: 11.937765941148417 and parameters: {'num_arvores': 331, 'critério': 'poisson', 'min_exemplos_split': 36, 'min_exemplos_folha': 12, 'num_max_atributos': 0.4970315680952754}. Best is trial 285 with value: 11.928484765389639.\n",
      "[I 2024-11-17 12:51:42,663] Trial 311 finished with value: 11.940479161115968 and parameters: {'num_arvores': 357, 'critério': 'poisson', 'min_exemplos_split': 50, 'min_exemplos_folha': 10, 'num_max_atributos': 0.4710519288853964}. Best is trial 285 with value: 11.928484765389639.\n",
      "[I 2024-11-17 12:51:51,013] Trial 312 finished with value: 11.939739696947955 and parameters: {'num_arvores': 338, 'critério': 'poisson', 'min_exemplos_split': 34, 'min_exemplos_folha': 9, 'num_max_atributos': 0.43240900938679205}. Best is trial 285 with value: 11.928484765389639.\n",
      "[I 2024-11-17 12:51:58,949] Trial 313 finished with value: 11.949234996363977 and parameters: {'num_arvores': 309, 'critério': 'poisson', 'min_exemplos_split': 37, 'min_exemplos_folha': 4, 'num_max_atributos': 0.44815980634240166}. Best is trial 285 with value: 11.928484765389639.\n",
      "[I 2024-11-17 12:52:10,385] Trial 314 finished with value: 11.941594536298453 and parameters: {'num_arvores': 438, 'critério': 'poisson', 'min_exemplos_split': 46, 'min_exemplos_folha': 10, 'num_max_atributos': 0.36869895518631707}. Best is trial 285 with value: 11.928484765389639.\n",
      "[I 2024-11-17 12:52:18,319] Trial 315 finished with value: 11.942398590532786 and parameters: {'num_arvores': 329, 'critério': 'poisson', 'min_exemplos_split': 38, 'min_exemplos_folha': 11, 'num_max_atributos': 0.3374415349260162}. Best is trial 285 with value: 11.928484765389639.\n",
      "[I 2024-11-17 12:52:29,645] Trial 316 finished with value: 11.943569876448722 and parameters: {'num_arvores': 462, 'critério': 'poisson', 'min_exemplos_split': 32, 'min_exemplos_folha': 8, 'num_max_atributos': 0.4567189426045093}. Best is trial 285 with value: 11.928484765389639.\n",
      "[I 2024-11-17 12:52:38,401] Trial 317 finished with value: 11.943142365321346 and parameters: {'num_arvores': 344, 'critério': 'poisson', 'min_exemplos_split': 42, 'min_exemplos_folha': 1, 'num_max_atributos': 0.38903839234706655}. Best is trial 285 with value: 11.928484765389639.\n",
      "[I 2024-11-17 12:52:49,848] Trial 318 finished with value: 11.952738818308696 and parameters: {'num_arvores': 446, 'critério': 'poisson', 'min_exemplos_split': 36, 'min_exemplos_folha': 71, 'num_max_atributos': 0.5115245231762624}. Best is trial 285 with value: 11.928484765389639.\n",
      "[I 2024-11-17 12:53:01,100] Trial 319 finished with value: 11.936496133375515 and parameters: {'num_arvores': 482, 'critério': 'poisson', 'min_exemplos_split': 45, 'min_exemplos_folha': 7, 'num_max_atributos': 0.4298670526804096}. Best is trial 285 with value: 11.928484765389639.\n",
      "[I 2024-11-17 12:53:11,926] Trial 320 finished with value: 11.937309105216395 and parameters: {'num_arvores': 460, 'critério': 'poisson', 'min_exemplos_split': 39, 'min_exemplos_folha': 9, 'num_max_atributos': 0.4838796997808124}. Best is trial 285 with value: 11.928484765389639.\n",
      "[I 2024-11-17 12:53:24,161] Trial 321 finished with value: 11.959933724683504 and parameters: {'num_arvores': 470, 'critério': 'poisson', 'min_exemplos_split': 35, 'min_exemplos_folha': 13, 'num_max_atributos': 0.5334212602217148}. Best is trial 285 with value: 11.928484765389639.\n",
      "[I 2024-11-17 12:53:36,190] Trial 322 finished with value: 11.937576905705743 and parameters: {'num_arvores': 454, 'critério': 'poisson', 'min_exemplos_split': 42, 'min_exemplos_folha': 6, 'num_max_atributos': 0.35315000408519787}. Best is trial 285 with value: 11.928484765389639.\n",
      "[I 2024-11-17 12:53:47,662] Trial 323 finished with value: 11.939039873819954 and parameters: {'num_arvores': 483, 'critério': 'poisson', 'min_exemplos_split': 33, 'min_exemplos_folha': 9, 'num_max_atributos': 0.4119399653105491}. Best is trial 285 with value: 11.928484765389639.\n",
      "[I 2024-11-17 12:53:58,348] Trial 324 finished with value: 11.944468916815987 and parameters: {'num_arvores': 472, 'critério': 'squared_error', 'min_exemplos_split': 38, 'min_exemplos_folha': 12, 'num_max_atributos': 0.44345361453283627}. Best is trial 285 with value: 11.928484765389639.\n",
      "[I 2024-11-17 12:54:08,104] Trial 325 finished with value: 11.935060192338954 and parameters: {'num_arvores': 387, 'critério': 'poisson', 'min_exemplos_split': 47, 'min_exemplos_folha': 11, 'num_max_atributos': 0.3925415744033826}. Best is trial 285 with value: 11.928484765389639.\n",
      "[I 2024-11-17 12:54:15,482] Trial 326 finished with value: 11.92950526015482 and parameters: {'num_arvores': 283, 'critério': 'poisson', 'min_exemplos_split': 40, 'min_exemplos_folha': 8, 'num_max_atributos': 0.467843583649067}. Best is trial 285 with value: 11.928484765389639.\n",
      "[I 2024-11-17 12:54:23,183] Trial 327 finished with value: 11.937661484461607 and parameters: {'num_arvores': 286, 'critério': 'poisson', 'min_exemplos_split': 35, 'min_exemplos_folha': 10, 'num_max_atributos': 0.4652129688376956}. Best is trial 285 with value: 11.928484765389639.\n",
      "[I 2024-11-17 12:54:30,505] Trial 328 finished with value: 11.940062930423249 and parameters: {'num_arvores': 303, 'critério': 'poisson', 'min_exemplos_split': 44, 'min_exemplos_folha': 8, 'num_max_atributos': 0.4981875669290302}. Best is trial 285 with value: 11.928484765389639.\n",
      "[I 2024-11-17 12:54:37,889] Trial 329 finished with value: 11.943521358097446 and parameters: {'num_arvores': 282, 'critério': 'friedman_mse', 'min_exemplos_split': 39, 'min_exemplos_folha': 9, 'num_max_atributos': 0.4800699090222404}. Best is trial 285 with value: 11.928484765389639.\n",
      "[I 2024-11-17 12:54:44,811] Trial 330 finished with value: 11.945708095330975 and parameters: {'num_arvores': 262, 'critério': 'poisson', 'min_exemplos_split': 37, 'min_exemplos_folha': 7, 'num_max_atributos': 0.45294680171536816}. Best is trial 285 with value: 11.928484765389639.\n",
      "[I 2024-11-17 12:54:51,868] Trial 331 finished with value: 11.939694904258236 and parameters: {'num_arvores': 267, 'critério': 'poisson', 'min_exemplos_split': 31, 'min_exemplos_folha': 11, 'num_max_atributos': 0.4320984472196083}. Best is trial 285 with value: 11.928484765389639.\n",
      "[I 2024-11-17 12:54:59,833] Trial 332 finished with value: 11.938285922451588 and parameters: {'num_arvores': 298, 'critério': 'poisson', 'min_exemplos_split': 43, 'min_exemplos_folha': 10, 'num_max_atributos': 0.4763155466479801}. Best is trial 285 with value: 11.928484765389639.\n",
      "[I 2024-11-17 12:55:11,542] Trial 333 finished with value: 11.937582394186448 and parameters: {'num_arvores': 442, 'critério': 'poisson', 'min_exemplos_split': 40, 'min_exemplos_folha': 9, 'num_max_atributos': 0.3735063780767789}. Best is trial 285 with value: 11.928484765389639.\n",
      "[I 2024-11-17 12:55:19,345] Trial 334 finished with value: 11.94260291488532 and parameters: {'num_arvores': 316, 'critério': 'poisson', 'min_exemplos_split': 33, 'min_exemplos_folha': 13, 'num_max_atributos': 0.421292038727527}. Best is trial 285 with value: 11.928484765389639.\n",
      "[I 2024-11-17 12:55:26,738] Trial 335 finished with value: 11.935553433407954 and parameters: {'num_arvores': 278, 'critério': 'poisson', 'min_exemplos_split': 50, 'min_exemplos_folha': 8, 'num_max_atributos': 0.45603051744171264}. Best is trial 285 with value: 11.928484765389639.\n",
      "[I 2024-11-17 12:55:33,940] Trial 336 finished with value: 11.994454705430362 and parameters: {'num_arvores': 253, 'critério': 'poisson', 'min_exemplos_split': 35, 'min_exemplos_folha': 7, 'num_max_atributos': 0.5051566773475716}. Best is trial 285 with value: 11.928484765389639.\n",
      "[I 2024-11-17 12:55:45,721] Trial 337 finished with value: 11.933235825506047 and parameters: {'num_arvores': 452, 'critério': 'poisson', 'min_exemplos_split': 38, 'min_exemplos_folha': 10, 'num_max_atributos': 0.4382839861925656}. Best is trial 285 with value: 11.928484765389639.\n",
      "[I 2024-11-17 12:55:57,279] Trial 338 finished with value: 11.950379173948216 and parameters: {'num_arvores': 463, 'critério': 'poisson', 'min_exemplos_split': 2, 'min_exemplos_folha': 8, 'num_max_atributos': 0.4122146579305219}. Best is trial 285 with value: 11.928484765389639.\n",
      "[I 2024-11-17 12:56:03,962] Trial 339 finished with value: 11.972682675240145 and parameters: {'num_arvores': 243, 'critério': 'poisson', 'min_exemplos_split': 42, 'min_exemplos_folha': 10, 'num_max_atributos': 0.5557083582318627}. Best is trial 285 with value: 11.928484765389639.\n",
      "[I 2024-11-17 12:56:13,366] Trial 340 finished with value: 11.94274523948632 and parameters: {'num_arvores': 361, 'critério': 'poisson', 'min_exemplos_split': 46, 'min_exemplos_folha': 9, 'num_max_atributos': 0.35098733114301667}. Best is trial 285 with value: 11.928484765389639.\n",
      "[I 2024-11-17 12:56:24,785] Trial 341 finished with value: 11.93750277232396 and parameters: {'num_arvores': 426, 'critério': 'poisson', 'min_exemplos_split': 36, 'min_exemplos_folha': 11, 'num_max_atributos': 0.3888507056515152}. Best is trial 285 with value: 11.928484765389639.\n",
      "[I 2024-11-17 12:56:33,614] Trial 342 finished with value: 11.932739697444601 and parameters: {'num_arvores': 348, 'critério': 'poisson', 'min_exemplos_split': 40, 'min_exemplos_folha': 8, 'num_max_atributos': 0.47109289712664454}. Best is trial 285 with value: 11.928484765389639.\n",
      "[I 2024-11-17 12:56:42,108] Trial 343 finished with value: 11.94646164579533 and parameters: {'num_arvores': 323, 'critério': 'poisson', 'min_exemplos_split': 44, 'min_exemplos_folha': 6, 'num_max_atributos': 0.4949098817523846}. Best is trial 285 with value: 11.928484765389639.\n",
      "[I 2024-11-17 12:56:51,397] Trial 344 finished with value: 11.970482212457886 and parameters: {'num_arvores': 336, 'critério': 'poisson', 'min_exemplos_split': 39, 'min_exemplos_folha': 7, 'num_max_atributos': 0.524054808355159}. Best is trial 285 with value: 11.928484765389639.\n",
      "[I 2024-11-17 12:57:02,070] Trial 345 finished with value: 11.941705324434647 and parameters: {'num_arvores': 397, 'critério': 'poisson', 'min_exemplos_split': 34, 'min_exemplos_folha': 8, 'num_max_atributos': 0.47715004570201186}. Best is trial 285 with value: 11.928484765389639.\n",
      "[I 2024-11-17 12:57:10,893] Trial 346 finished with value: 11.942746507832158 and parameters: {'num_arvores': 346, 'critério': 'poisson', 'min_exemplos_split': 37, 'min_exemplos_folha': 7, 'num_max_atributos': 0.4626598231473508}. Best is trial 285 with value: 11.928484765389639.\n",
      "[I 2024-11-17 12:57:19,153] Trial 347 finished with value: 11.935602743850424 and parameters: {'num_arvores': 317, 'critério': 'poisson', 'min_exemplos_split': 42, 'min_exemplos_folha': 5, 'num_max_atributos': 0.4442477974683648}. Best is trial 285 with value: 11.928484765389639.\n",
      "[I 2024-11-17 12:57:27,742] Trial 348 finished with value: 11.936968674623904 and parameters: {'num_arvores': 333, 'critério': 'poisson', 'min_exemplos_split': 47, 'min_exemplos_folha': 9, 'num_max_atributos': 0.48919242629984894}. Best is trial 285 with value: 11.928484765389639.\n",
      "[I 2024-11-17 12:57:39,627] Trial 349 finished with value: 11.94339402325813 and parameters: {'num_arvores': 442, 'critério': 'squared_error', 'min_exemplos_split': 31, 'min_exemplos_folha': 8, 'num_max_atributos': 0.4655926194295036}. Best is trial 285 with value: 11.928484765389639.\n",
